review_id,user_id,review_date,review,pos_food_and_beverages_summary,pos_inflight_entertainment_summary,pos_wifi_connectivity_summary,pos_value_for_money_summary,pos_ground_service_summary,pos_cabin_staff_service_summary,pos_seat_comfort_summary,neg_food_and_beverages_summary,neg_inflight_entertainment_summary,neg_wifi_connectivity_summary,neg_value_for_money_summary,neg_ground_service_summary,neg_cabin_staff_service_summary,neg_seat_comfort_summary,flight_id,flight_date,route_id,seat_type,is_recommended,rating_overall,rating_seat_comfort,rating_cabin_staff_service,rating_ground_service,rating_value_for_money,rating_food_beverages,rating_ife,rating_wifi_connectivity
50,87,2024-12-10,先日は大変お世話になりました。普段はあまり海外に行く機会がないのですが、たまたま仕事でロンドンへ行くことになり、久しぶりにビジネスクラスを利用しました。ビジネスクラスで提供された食事は、まるでレストランで食べるようなクオリティだった。見た目も美しく、食べるのが楽しみだった。長時間のフライトでしたが、シートのリクライニング角度が広く、休憩中に快適に横になれました。,ビジネスクラスで提供された食事は、レストランで食べるようなクオリティで、見た目も美しく、食べるのが楽しみだった。,食事はまるでレストランで食べるようなクオリティで、見た目も美しく、食べるのが楽しみだった。,-,ビジネスクラスの食事はレストラン並みのクオリティで、見た目も美しく、長時間のフライトでも快適に過ごせた。,食事はまるでレストランで食べるようなクオリティで、見た目も美しく、食べるのが楽しみだった。,食事はまるでレストランで食べるようなクオリティで、見た目も美しく、食べるのが楽しみだった。,長時間のフライトでも快適に横になれた。,-,-,-,-,-,-,-,B905-12,2024-12-09,HND-SFO,Premium Economy,True,9,6,9,10,6,5,5,6
51,70,2025-02-23,最近海外旅行でよく利用する航空会社があるのですが、残念な体験をしたので書いておきます。私は胃腸が弱いので、事前に特別食をリクエストしていました。実際提供された食事はとてもヘルシーで消化に優しく、フライト中も快適に過ごせました。しかし、映画を楽しんでいた時に途中で止めてしまい、再開する時に前の場所に戻らないため、非常に不便でした。また、フライト中に隣の乗客が体調を崩してしまったのですが、スタッフが無関心な態度を取っていました。問題が解決するまで何も手を貸してくれず、無言で座っているだけだったのです。機内スタッフにはもう少し責任感を持ってほしいと思いました。,事前にリクエストした特別食はとてもヘルシーで消化に優しく、フライト中も快適に過ごせました。,映画を楽しんでいたが、途中で止まった後に再開する際に前の場所に戻らないことがあり、不便だった。,映画を楽しんでいた時に途中で止めてしまい、再開する時に前の場所に戻らないため、非常に不便でした。,事前にリクエストした特別食はとてもヘルシーで消化に優しく、フライト中も快適に過ごせました。,事前にリクエストした特別食はとてもヘルシーで消化に優しく、フライト中も快適に過ごせました。,事前にリクエストしていた特別食はとてもヘルシーで消化に優しく、快適に過ごせました。,事前に特別食をリクエストした食事がヘルシーで消化に優しく、フライト中も快適に過ごせた。,食事はとてもヘルシーで消化に優しく、快適に過ごせた。,食事はとてもヘルシーで消化に優しく、快適に過ごせた。,映画を楽しんでいた時に途中で止めてしまい、再開する時に前の場所に戻らないため、非常に不便でした。,スタッフの対応に問題があり、支払った金額に見合ったサービスを提供してもらえなかった。,スタッフが隣の乗客の体調不良に対して無関心な態度を取り、問題解決に手を貸さなかった。,隣の乗客が体調を崩した際に、スタッフが無関心な態度を取り、問題解決まで何も手を貸さなかったのが残念だった。,映画鑑賞中に途中で止まってしまい、再開しても前の場所から再生されなかった。,A470-900,2025-02-22,NRT-LHR,Premium Economy,False,6,3,6,9,7,6,2,7
52,88,2025-04-06,先日利用した際、事前に特別食をリクエストしていたにもかかわらず、空港スタッフが注文を漏らしていたため、とても残念だった。到着時にクレームを入れたが、対応が遅く不満が残った。実は私自身、食事にアレルギーがあるため、事前にしっかりと伝えておいたつもりだったが、実際に出された食事にはアレルギー物質が含まれていた。安全性をもっと重視してほしいと感じた。,-,-,-,-,-,-,-,事前に特別食をリクエストしていたが、スタッフの手違いでアレルギー物質が含まれた食事が出され、安全性に対する不満が残った。,事前に特別食をリクエストしていたが、スタッフの手違いでアレルギー物質が含まれた食事が出され、安全性に対する不満が残った。,-,安全性に対する配慮が不足しており、追加の対応を求めていたにもかかわらず不十分だったため、支払った金額に見合った価値が得られなかった。,空港スタッフが事前にリクエストされていた特別食の注文を漏らしており、到着時のクレーム対応も遅かった。,事前に特別食をリクエストしていたが、空港スタッフが注文を漏らしており、到着時のクレーム対応も遅かった。,-,A470-900,2025-04-05,NRT-CDG,First Class,False,2,6,5,2,5,7,7,3
53,17,2024-12-18,最近海外旅行で利用した航空会社のサービスについて感想を述べたいと思います。私は普段から仕事で海外出張することが多く、今回も取引先との打ち合わせのためにフライトを利用しました。スタッフの対応は非常に良く、機内での役割をよく理解していて、いつでも頼んだことをきちんと処理してくれました。しかし、機内Wi-Fiがあまりにも遅く、せっかくの旅行中に重要な情報を探すことができなかったのは残念でした。お金を払う意味がなかったと感じました。また、フライトが非常に混雑していて、飲み物を頼んでもなかなか回ってこなかったのもストレスでした。さらにお水がないと言われてかなり不安になったこともありました。,-,スタッフの対応は非常に良かった。,-,機内Wi-Fiの利用料金に見合った快適さが感じられなかった。,スタッフの対応は非常に良く、機内での役割をよく理解していて、いつでも頼んだことをきちんと処理してくれました。,スタッフの対応は非常に良く、頼んだことをいつでもきちんと処理してくれました。,-,飲み物を頼んでもなかなか回ってこず、またお水がないと言われたのがストレスだった。,飲み物を頼んでもなかなか回ってこず、またお水がないと言われたのがストレスだった。,機内Wi-Fiが遅くて重要な情報が探せず、お金を払った意味がなかった。,機内Wi-Fiが遅く、お金を払った割に役に立たなかった。,"スタッフの対応は非常に良かったと述べられており、地上サービスに関するネガティブな内容は記載されていないため、- とすべきですが、レビュー全体を通して「地上サービス」に関するネガティブな点についての直接的な言及がないため、- となります。 
-
が正解です。 

ただし、より正確にレビューに即した回答をするなら、レビュー内容に「地上サービス」についてのネガティブな点が直接的に述べられていないため、とりあえず「-」とすることにします。

正解は「-」です。",フライトが混雑していたため、飲み物を頼んでもなかなか回ってこなかった。,フライトが非常に混雑していたため、飲み物を頼んでもなかなか回ってこなかったり、お水がないと言われたりしてストレスを感じた。,E180-E2,2024-12-17,NRT-LHR,Business Class,False,6,7,5,2,7,3,9,6
54,57,2025-01-19,先日は久しぶりに海外旅行で日本を離れ、アメリカのニューヨークへ行ってきました。私は普段あまり飛行機に乗る機会がないのですが、今回は特に長距離だったので、機内でのサービスに期待していました。実際、機内食がとても美味しく、特にデザートが絶品だったので驚きました。飛行機の中でこんなに満足した食事を食べたのは初めてです。映画も楽しみたくてエンターテイメントシステムをチェックしてみると、映像の画質が非常に高く、最高の状態で映画を楽しめました。設備の進化に感心しました。フライト中に提供されたサラダも新鮮で美味しかったです。食事が軽くて健康的で、長時間のフライトでも体が楽だったので、快適な旅ができました。,機内食が美味しく、デザートが絶品で、提供されたサラダも新鮮で健康的だったため、長時間のフライトでも快適に過ごせた。,映像の画質が非常に高く、最高の状態で映画を楽しめた。,-,機内食が美味しく、特にデザートが絶品で、長時間のフライトでも体が楽だったので、快適な旅ができた。,-,機内食がとても美味しく、特にデザートが絶品で、フライト中に提供されたサラダも新鮮で美味しかった。,長時間のフライトでも体が楽だったので、快適な旅ができました。,-,-,-,-,-,-,-,A392-300,2025-01-18,HND-ITM,Premium Economy,True,9,10,5,10,7,6,6,5
55,55,2025-03-02,先日は家族で初めての海外旅行で利用しました。4歳の子どもが楽しめるサービスが多く、特に子ども向けのアニメーション映画が充実しており、子どもが機内で退屈することなく過ごせました。しかし、機内エンタメの音声が途切れがちで、映画に集中できませんでした。改善をお願いしたいです。今回、ビジネスクラスを利用しましたが、高い料金を払ったが、その分の価値が十分に感じられた。特に快適な座席と質の高いサービスに満足した。,-,子ども向けのアニメーション映画が充実しており、子どもが退屈することなく過ごせた。,"-

（レビューに「機内Wi-Fiと接続性」に関するポジティブな内容がなかったため、「-」と回答） 
代わりに、レビューには機内エンタメの音声が途切れがちだったというネガティブな内容があったため、接続性に関する改善の余地があることがうかがえる。ただし、それはポジティブな内容ではないため、条件に合わない。",高い料金を払ったが、その分の価値が十分に感じられた。,高い料金を払ったが、その分の価値が十分に感じられた。,質の高いサービスに満足した。,快適な座席に満足した。,-,-,音声が途切れがちで映画に集中できなかった。,高い料金を払ったが、その分の価値が十分に感じられたとあるため、ネガティブな内容は見当たらないが、機内エンタメの音声が途切れがちだった点は改善してほしいと述べられているため、料金に見合ったエンタメの質の向上が求められている。,-,機内エンタメの音声が途切れがちだった。,-,E260-E3,2025-03-01,NRT-CDG,Economy Class,True,8,9,5,5,9,5,5,7
56,80,2025-02-26,"最近海外旅行で利用した航空会社のサービスについて、率直な感想を述べたいと思います。私は普段から仕事が忙しく、たまの休暇を利用してリフレッシュしたいと考えていたので、快適なフライトを期待していました。しかし、座席のリクライニングがほとんど倒れず、リラックスできませんでした。改善を希望します。

一方で、フライト後の空港スタッフの対応は素晴らしかったです。私の荷物を早急に手配してくれて、他の乗客と比べてスムーズに荷物を受け取ることができました。スタッフの気配りがとても良かったと感じています。

ただ、フライト中はWi-Fiの接続に苦労しました。映画を見ようとしたけれど、Wi-Fiが途切れがちで何度も再接続を試みたものの、全然うまくいきませんでした。Wi-Fiの質が低すぎて、快適に過ごしたかっただけなのに、ストレスが溜まる結果となりました。",-,"-

（理由：ポジティブな内容が含まれているのは「フライト後の空港スタッフの対応」についてのみで、「機内エンターテイメント」に関する記述はすべてネガティブな内容だからです。）",-,空港スタッフの対応が素晴らしく、荷物をスムーズに受け取ることができた。,フライト後の空港スタッフの対応は素晴らしく、荷物を早急に手配してくれたおかげでスムーズに荷物を受け取ることができました。,空港スタッフの対応は素晴らしく、荷物を早急に手配してくれたのでスムーズに受け取ることができ、気配りが良かった。,-,-,-,フライト中はWi-Fiの接続に苦労し、途切れがちで何度も再接続を試みたものの、全然うまくいかずストレスが溜まった。,サービスに見合った価格ではないと感じたのは、座席のリクライニングがほとんど倒れずリラックスできなかったことと、フライト中にWi-Fiが頻繁に途切れストレスを感じたため。,-,座席のリクライニングがほとんど倒れず、リラックスできなかった。,座席のリクライニングがほとんど倒れず、リラックスできなかった。,S410-XLR,2025-02-25,NRT-LHR,First Class,False,6,5,3,7,5,2,6,9
57,2,2025-02-18,先日は初めて海外旅行でこの航空会社を利用しました。普段から仕事でパソコンを使っているため、機内でどれくらいネットが快適に使えるのかとても気になっていました。実際使ってみると機内Wi-Fi接続が非常に安定していて、快適に映画や動画を楽しめました。機内Wi-Fiが非常にスムーズで、途中で切れることなく、フライトの間中ずっと快適にインターネットを使えたので、とても助かりました。料金は高かったですが、その分、サービスが素晴らしく、非常に満足できました。価格に見合った価値が提供されていたと思います。次回も利用したいです。,-,Wi-Fi接続が非常に安定していて、快適に映画や動画を楽しめました。,機内Wi-Fi接続が非常に安定していて、途切れることなく快適にインターネットを利用できた。,料金は高かったが、その分サービスが素晴らしく、価値に見合ったサービスが提供されていた。,-,"-

このレビューには「客室スタッフのサービス」に関する具体的な記述がありません。レビューでは機内Wi-Fiの快適さや安定性について高く評価していますが、客室スタッフのサービスについては触れられていないため、「-」と回答します。",機内Wi-Fiが非常に安定していて、快適に映画や動画を楽しめた。,-,-,-,料金は高かったが、その分サービスが素晴らしく、価格に見合った価値が提供されていた。,-,-,-,B830-10,2025-02-17,NRT-SIN,Premium Economy,True,9,9,7,6,9,9,6,7
58,3,2025-02-26,先日は仕事でシドニーに行くため、成田からの夜行便を利用しました。私は長時間のフライトになるため、できるだけ快適に過ごそうと、事前に窓際の席を予約していました。到着後、現地でのミーティングに備えて、飛行機の中でネットを使って資料の最終チェックをしようと思っていたのですが、接続が非常に遅く、ほとんど何もできませんでした。さらに、座席で寝ていた時、スタッフが私の足元を無理やり通ろうとして、非常に不快に感じました。少しの気配りや声掛けがあれば、もっと快適に過ごせたはずです。サービスの向上を期待しています。,-,-,接続が非常に遅く、ほとんど何もできませんでした。,-,-,-,-,-,-,接続が非常に遅く、資料の最終チェックがほとんどできなかった。,長時間フライトにもかかわらず、ネット接続が遅く仕事がほとんどできず、スタッフの配慮に欠ける対応もあったため、期待したサービスに見合う価値が感じられなかった。,スタッフが席の間を通る際、足元に無理やり踏み込んできて不快に感じた。少しの気配りや声掛けがあればよかった。,座席で寝ていた時、スタッフが私の足元を無理やり通ろうとして不快に感じたので、少しの気配りや声掛けが欲しかった。,スタッフが席の間を通る際の気配りや声掛けがなく不快に感じた。,B812-6,2025-02-25,HND-CTS,Business Class,False,4,7,7,5,6,3,3,6
59,73,2025-01-26,最近、家族で海外旅行に行くために航空会社を利用しました。子供を連れての長時間のフライトだったので、事前に座席やサービスについて調べていました。実際に搭乗してみると、座席の間には荷物が多すぎて足を伸ばすスペースがありませんでした。子供がぐずり始めたときには、スタッフに助けを求めたのですが、なかなか対応してもらえず、少し残念でした。もう少し子供連れに配慮して、優しく声をかけてほしいと思いました。しかし、座席自体は柔らかく、リクライニングもスムーズで、映画を観るのには最適な環境でした。,-,座席自体は柔らかく、リクライニングもスムーズで、映画を観るのには最適な環境でした。,-,座席自体は柔らかく、リクライニングもスムーズで、映画を観るのには最適な環境だった。,座席自体は柔らかく、リクライニングもスムーズで、映画を観るのには最適な環境でした。,子供がぐずり始めたとき、スタッフの対応が遅く、もう少し子供連れに配慮して優しく声をかけてほしかった。,座席自体は柔らかく、リクライニングもスムーズで、映画を観るのには最適な環境でした。,-,-,-,子供連れに対する配慮が不足していたため、支払った額に見合ったサービスではなかった。,子供がぐずり始めたときに助けを求めたが、なかなか対応してもらえず、もう少し子供連れに配慮して優しく声をかけてほしかった。,子供がぐずり始めたときに助けを求めたが、なかなか対応してもらえず、もう少し子供連れに配慮して優しく声をかけてほしかった。,足を伸ばすスペースがなかった。,B812-6,2025-01-25,NRT-LHR,Economy Class,False,6,5,3,7,5,5,2,5
60,20,2025-04-23,先日利用した航空サービスが最悪だった。まずフライト中に何度も飲み物を頼んだが、なかなか届かず、乾いた喉を我慢する羽目になった。サービスが遅くて不快だった。チェックイン時には手荷物を預けた後に、シートベルトの緩みを指摘したが、スタッフはとても無関心で、また座席のクッションが壊れていた際も無視され、対処してもらえなかった。私は仕事で頻繁に飛行機を利用するが、値段が高い割に、食事のクオリティが低く、全体的なコストパフォーマンスに疑問を感じた。,-,-,-,-,-,-,-,フライト中に何度も飲み物を頼んだがなかなか届かず、また食事のクオリティが低く値段が高い割にコストパフォーマンスが悪かった。,フライト中に何度も飲み物を頼んだがなかなか届かず、また食事のクオリティが低く値段が高い割にコストパフォーマンスが悪かった。,-,値段が高い割に食事のクオリティが低い。,チェックイン時に預けた手荷物に関する不満は特になかったものの、シートベルトの緩みを指摘したら無関心に対応され、座席のクッションが壊れていた際も対処してもらえなかった。,フライト中に何度も飲み物を頼んだがなかなか届かず、サービスが遅くて不快だった。,シートベルトの緩みを指摘した際、スタッフが無関心だったことに加え、座席のクッションが壊れていても対処してもらえなかった。,A425-900,2025-04-22,HND-SFO,Economy Class,False,2,5,6,3,3,6,2,5
61,44,2025-03-13,先日、久しぶりに海外旅行で長距離フライトを利用しました。私は普段あまり食べないタイプの機内食を事前に注文していたのですが、到着した食事はメニューにないものでした。スタッフは無言でそれを置いていったので、とても残念な思いをしました。一方で、フライト中はスタッフの気配りが行き届いており、長時間のフライトでも快適に過ごすことができました。しかし、シートのデザインが少し古臭く感じられ、もっとモダンなものにしてほしいと思いました。,フライト中はスタッフの気配りが行き届いており、快適に過ごすことができました。,フライト中はスタッフの気配りが行き届いており、快適に過ごすことができました。,-,フライト中はスタッフの気配りが行き届いており、快適に過ごすことができました。,フライト中はスタッフの気配りが行き届いており、快適に過ごすことができました。,フライト中はスタッフの気配りが行き届いており、快適に過ごすことができました。,フライト中はスタッフの気配りが行き届いており、長時間のフライトでも快適に過ごすことができました。,事前に注文したメニューと異なる機内食が無言で提供されたのが残念だった。,事前に注文したメニューと異なる機内食が無言で提供されたのが残念だった。,-,シートのデザインが少し古臭く感じられ、もっとモダンなものにしてほしいと思った。,事前に注文した機内食と異なる食事が無言で提供された。,注文していない機内食が無言で提供されたのは残念だった。,シートのデザインが少し古臭く感じられた。,E180-E2,2025-03-12,HND-ITM,Economy Class,True,6,6,4,6,7,6,2,5
62,47,2025-03-09,先日、孫のスポーツイベントを観戦するために飛行機で移動しました。孫は今、スポーツに夢中で、私も応援しているので、飛行機内でのスポーツイベント中継を楽しみにしていたのですが、全くありませんでした。非常に残念でした。また、飛行機内で孫と連絡を取るためにネットを利用しようとしたのですが、Wi-Fiに接続できませんでした。事前に調べた際には利用できるとの情報もあったので、時間を無駄にしただけでなく、疲れも倍増しました。,-,スポーツイベント中継がなかった。,-,-,-,-,-,-,-,ネットに接続できず、孫と連絡を取ることができなかったため、時間を無駄にしただけでなく、疲れも倍増した。,有料サービスであるWi-Fiが利用できず、時間を無駄にし疲れも倍増した。,飛行機内で利用しようとしたWi-Fiに接続できず、時間を無駄にし、疲れも倍増した。,飛行機内でスポーツイベント中継が放映されておらず、また、事前に利用できるとの情報があったにも関わらず、機内Wi-Fiに接続できなかった。,-,A430-200,2025-03-08,HND-CTS,Business Class,False,2,3,7,7,7,2,6,5
