review_id,user_id,review_date,review,pos_food_and_beverages_summary,pos_inflight_entertainment_summary,pos_wifi_connectivity_summary,pos_value_for_money_summary,pos_ground_service_summary,pos_cabin_staff_service_summary,pos_seat_comfort_summary,neg_food_and_beverages_summary,neg_inflight_entertainment_summary,neg_wifi_connectivity_summary,neg_value_for_money_summary,neg_ground_service_summary,neg_cabin_staff_service_summary,neg_seat_comfort_summary,flight_id,flight_date,route_id,seat_type,is_recommended,rating_overall,rating_seat_comfort,rating_cabin_staff_service,rating_ground_service,rating_value_for_money,rating_food_beverages,rating_ife,rating_wifi_connectivity
17,78,2024-12-19,先日、家族で海外旅行に行った際、子どもの機嫌が悪くなってぐずり始めたときに、航空会社のスタッフに助けを求めたが、無視された。海外旅行は初めてで、子どもも小さかったので心配だったが、もう少し子供連れに配慮して、優しく声をかけてほしいと思った。しかし、別の便では、子どもがぐずり始めたときに、スタッフがすぐにおもちゃや絵本を持ってきてくれた。予想以上に気配りが行き届いていて、感謝している。,-,子どもがぐずった時にスタッフがすぐにおもちゃや絵本を持ってきてくれて、予想以上の気配りに感謝しています。,-,-,-,子どもがぐずり始めた時、スタッフがすぐにおもちゃや絵本を持ってきてくれて、予想以上の気配りに感謝しています。,-,-,-,-,-,-,子どもがぐずった時に助けを求めたのに無視され、初めての海外旅行で子連れだったため不安だったので、もっと配慮して声をかけてほしかった。,-,B845-9,2024-12-18,HND-ITM,Economy Class,True,4,3,4,3,4,3,4,3
18,51,2025-03-27,先日は海外旅行で長時間のフライトでしたが、スタッフの皆さんがいつも快適に過ごせるように気配りをしてくれていたので、長時間でも全く不快に感じなかったです。ただ、機内エンターテイメントの映像の画質が悪く、何度も再起動しないと視聴できなかったのは残念でした。飛行機内の設備管理が甘いと感じました。しかし、旅行中に予期しない問題が起こった際には、スタッフが迅速かつ適切な解決策を提案してくれて、問題がスムーズに解決したので、総合的には良いサービスだったと思います。,-,-,-,-,旅行中に予期しない問題が発生した際、スタッフが迅速かつ適切な解決策を提案してくれたおかげで問題がスムーズに解決しました。,スタッフの皆さんが長時間フライト中も常に気配りをしてくれたおかげで快適に過ごせましたし、旅行中に予期しない問題が発生した際も迅速かつ適切な解決策を提案してくれて助かりました。,-,-,-,-,-,-,-,-,E190-E2X,2025-03-26,HND-CTS,Economy Class,True,4,2,4,3,4,4,4,5
19,40,2024-12-13,私は仕事でよく海外に行くが、最近は疲れが溜まっていたので、久しぶりにビジネスクラスでヨーロッパへ向かった。搭乗してまず感じたのは、思ったより機材が古かったことだ。私の足元のスペースが狭かったが、スタッフがすぐに配慮してくれ、リクライニングを調整してくれた。機内で出されたワインが非常に美味しく、フライト中にリラックスした時間を過ごせた。,機内で提供されたワインが非常に美味しく、フライト中にリラックスした時間を過ごせました。,-,-,-,-,足元のスペースが狭かった際、スタッフがすぐに配慮してリクライニングを調整してくれた。,スタッフが迅速に対応し、リクライニングを調整してくれたおかげで、狭かった足元スペースの問題が解消された。,-,-,-,-,-,-,機材が古く、足元のスペースが狭かった。,B845-9,2024-12-12,HND-SFO,Economy Class,True,4,4,3,4,4,3,3,3
20,98,2024-12-05,先月、家族と一緒に海外旅行に行くために夜行便を利用しました。子供たちが機内エンターテイメントでゲームを楽しんでいたのですが、ゲームコントローラが壊れていてスタートが押せないというトラブルがありました。CAさんに報告したところ、また戻って来ますと言われたまま、なかなか対応してもらえず、結局そのままになってしまいました。ただ、機内Wi-Fiの速度は速く、フライト中でも家族と連絡を取り合うことができたので、他の点では非常に助かりました。暇つぶしに紙の安全カードを眺めていたのが記憶に残っています。,-,-,高速なWi-Fiのおかげでフライト中も家族と連絡を取り合うことができて非常に助かりました。,-,-,-,-,-,-,-,-,-,CAさんに壊れたゲームコントローラを報告したが、対応すると言われたまま戻ってこず、結局問題は解決されなかった。,-,E190-E2X,2024-12-04,NRT-LHR,Premium Economy,False,3,2,4,4,3,4,3,3
51,11,2025-04-01,最近、海外旅行で長時間のフライトを利用しました。私は普段からSNSを頻繁に更新するので、フライト中もWi-Fiが安定していて助かりました。SNSや映画を観るのに困ることなく過ごせたのは非常に便利でした。また、機内食のサラダが新鮮で美味しかったです。食事が軽くて健康的で、長時間のフライトでも体が楽だったので、快適に過ごすことができました。しかし、旅行先で荷物が届かなかった時は空港スタッフに問い合わせたものの、返答が遅く、手続きも煩雑で、結局荷物が届くまでの数日間、非常に不便な思いをしました。,機内食のサラダが新鮮で美味しく、軽くて健康的だったので長時間のフライトでも体が楽でした。,長時間フライト中もWi-Fiが安定していたため、SNSの更新や映画鑑賞を快適に楽しむことができました。,フライト中のWi-Fiが安定していたため、SNSの更新や映画鑑賞を問題なく楽しむことができました。,-,-,-,-,-,-,-,-,荷物が届かなかった時、空港スタッフの返答が遅く、手続きも煩雑で、荷物が届くまでの数日間非常に不便だった。,-,-,S450-XLR,2025-03-31,NRT-CDG,Economy Class,True,4,3,4,4,4,4,4,2
52,52,2024-12-18,最近、家族で海外旅行に行くために、久しぶりにこの航空会社を利用しました。事前に機内食を注文していたのですが、届いた食事がメニューにないものだったのでがっかりしました。スタッフは特にお詫びもなく無言で去って行ったので、せっかく楽しみにしていた食事が台無しになり、とても残念だった。しかし、提供された食事自体はヘルシーで消化に優しいもので、フライト中も快適に過ごすことができました。ただ、長時間座っていると背中が痛くなりました。背もたれの角度が調整できなかったので、少し不満でした。,提供された機内食はヘルシーで消化に優しく、フライト中も快適に過ごせました。,-,-,-,-,-,-,注文した機内食と実際に提供されたものが異なり、スタッフは謝罪もなく無言で去ってしまったため、楽しみにしていた食事体験が台無しになった。,注文した機内食と実際に提供されたものが異なり、スタッフは謝罪もなく無言で去ってしまったため、楽しみにしていた食事体験が台無しになった。,-,-,-,機内食が注文したものと違っていたのに、スタッフは謝罪もなく無言で立ち去ってしまい、楽しみにしていた食事体験が台無しになった。,長時間のフライトで背もたれの角度が調整できず、背中が痛くなってしまった。,A392-300,2024-12-17,HND-SFO,First Class,False,3,4,3,4,4,3,2,4
53,29,2025-05-05,最近、仕事で海外出張が増えたので、効率よく仕事をするために、航空会社のプレミアムエコノミーを利用した。乗客に対してフレンドリーな対応をしてほしかったが、何度も頼みごとをすると、明らかに不快そうな顔をされて返答が遅かった。出張中にフライト時間を有効活用しようと思っていたが、Wi-Fi接続が不安定で、仕事が全く進まなかった。コストを払ったのに、あんなに使えないネット接続はあり得ない。さらに、シートの音量がバラバラで、快適に映画を楽しめなかった。,-,-,-,-,-,-,-,-,-,Wi-Fi接続が不安定で仕事が全く進まず、コストを払ったにもかかわらず使い物にならなかった。,プレミアムエコノミーの料金を支払ったのに、Wi-Fi接続が不安定で仕事が全く進まなかった。,-,何度も頼みごとをすると、明らかに不快そうな顔をされて返答が遅かった。,シートの音量がバラバラで、映画を快適に楽しめなかった。,B905-12,2025-05-04,NRT-CDG,Premium Economy,False,2,2,4,4,3,1,3,3
54,84,2024-12-15,私は家族でよく海外旅行に行くのですが、最近はコロナ禍での規制が緩和されたこともあり、久しぶりに海外旅行を楽しんできました。利用した航空会社は以前も利用したことがあり、機内食も美味しかったので期待していたのですが、残念な点がいくつかありました。まず、機内の広告が多すぎて、映画を楽しんでいる最中でも何度も中断されてストレスでした。また、フライト中、飲み物のサービスをお願いしたが、スタッフが何度も通り過ぎてしまい、最終的に自分でカートまで取りに行く羽目になった。搭乗客数に対して十分な人数がいたはずなのに、どうしてこんなに対応が遅いのか理解できなかった。,機内食が美味しかったので期待していた。,-,-,-,-,-,-,フライト中に飲み物サービスを頼んだが、スタッフが何度も通り過ぎてしまい、結局自分でカートまで取りに行かなければならなかった。,フライト中に飲み物サービスを頼んだが、スタッフが何度も通り過ぎてしまい、結局自分でカートまで取りに行かなければならなかった。,-,-,-,飲み物のサービスを依頼したにもかかわらず、スタッフが何度も通り過ぎてしまい、結局自分でカートまで取りに行かなければならなかった。,-,S410-XLR,2024-12-14,HND-SFO,Business Class,False,2,2,4,3,4,4,3,3
55,78,2024-12-31,今回初めてビジネスクラスを利用したが、高い料金を払った価値があり、快適な座席、優れたサービス、そして美味しい食事に満足した。料金が高かったが、その分だけ快適さが充実しており、全体的に大満足のフライトだった。私は普段あまり海外旅行をしないので、贅沢な時間を楽しんだ。長時間のフライトで、機内食を楽しみにしていたが、食事の量が少なく、物足りなかった。もう少しボリュームが欲しい。,美味しい食事に満足した。,-,-,高い料金を払ったが、快適な座席、優れたサービス、美味しい食事が充実しており、その価値は十分にあった。,-,優れたサービスに満足した。,高い料金を払った価値があり、快適な座席に満足した。,機内食の量が少なく物足りなかったので、もう少しボリュームが欲しい。,機内食の量が少なく物足りなかったので、もう少しボリュームが欲しい。,-,-,-,-,-,B905-12,2024-12-30,NRT-CDG,First Class,True,4,4,3,3,5,3,4,3
56,19,2025-03-27,友人の結婚式に出席するために、久しぶりに海外へ旅行しました。約10時間の長距離フライトでしたが、機内エンタメの選択肢が豊富で、最新の映画やドラマ、音楽などを楽しむことができ、退屈せずに過ごすことができました。しかし、座席に着いたところ、シートカバーが汚れていたので少し残念でした。もっと清潔に保って欲しいと思います。,-,最新の映画やドラマ、音楽などの選択肢が豊富で、10時間の長距離フライトでも退屈せずに過ごせました。,-,-,-,-,-,-,-,-,-,-,-,シートカバーが汚れていたので、もっと清潔に保って欲しいと思いました。,A450-800,2025-03-26,NRT-CDG,Premium Economy,True,4,5,3,4,4,4,4,3
57,44,2025-01-05,先日、家族で海外旅行に行った際、利用した航空会社のサービスに感動しました。機内エンターテイメントで子ども向けのアニメーション映画が充実しており、子どもが機内で退屈することなく過ごせました。映像が美しく、映画館で観るような臨場感を楽しめました。素晴らしい体験です。しかし、飛行中に気流の乱れがあり、緊急の対応が必要だった際に、スタッフが指示を出してくれず、周囲の乗客が混乱していた。スタッフはもっと冷静に指導してくれるべきだった。,-,子ども向けアニメーション映画が充実しており、映像が美しく映画館のような臨場感で、子どもが退屈せずに過ごせました。,-,-,-,-,-,-,-,-,-,-,気流の乱れで緊急対応が必要な状況でスタッフが指示を出さず、乗客が混乱していたので、もっと冷静な指導が必要だった。,-,A470-900,2025-01-04,NRT-CDG,Premium Economy,True,4,5,4,4,4,3,1,3
58,76,2024-11-21,私は普段あまり海外旅行に行く機会がないのですが、たまたま仕事でアメリカに行くことになり、評判の良いこの航空会社を利用しました。初めての海外旅行で不安もありましたが、空港内の案内所での対応が非常に親切で、私の質問に丁寧に答えてくれたので安心して旅行を進められました。料金は少し高いと感じましたが、機内サービスや座席の快適さ、エンタメが素晴らしく、全体的に非常に満足しました。,-,エンタメが素晴らしく、全体的な満足度に貢献していました。,-,料金は少し高いと感じたが、機内サービスや座席の快適さ、エンターテイメントが素晴らしく、全体的に非常に満足できた。,空港内の案内所での対応が非常に親切で、質問に丁寧に答えてくれたおかげで安心して旅行を進められました。,-,座席が快適で、機内エンターテイメントも素晴らしかったです。,-,-,-,料金は少し高いと感じました。,-,-,-,A390-100,2024-11-20,NRT-CDG,Premium Economy,True,5,3,4,4,4,3,4,3
59,85,2025-02-13,先日利用したビジネスクラスの機内食が非常にシンプルで、期待外れだった。もっと豪華なメニューを提供してほしい。私は普段から仕事で海外出張することが多く、ビジネスクラスを利用する機会が多いが、今回のフライトでは高い料金に見合ったサービスが期待できなかった。特にフライト中の快適さが不足していて、価格に見合わないと感じた。,-,-,-,-,-,-,-,ビジネスクラスの機内食が非常にシンプルで期待外れだったため、高い料金に見合った豪華なメニューを提供してほしい。,ビジネスクラスの機内食が非常にシンプルで期待外れだったため、高い料金に見合った豪華なメニューを提供してほしい。,-,ビジネスクラスの高額な料金に対して、シンプルな機内食や快適さの不足など、サービスの質が見合っていない。,-,-,フライト中の快適さが不足していて、高額なビジネスクラス料金に見合わないと感じた。,A425-900,2025-02-12,NRT-SIN,Economy Class,False,2,4,3,1,3,4,3,3
60,58,2025-03-07,最近、家族で海外旅行に行くために航空会社を利用しました。私は仕事の関係で時差の関係でなかなか寝付けないことが多く、フライト中にリラックスできるサービスがあると嬉しいと思っていました。機内Wi-Fiが快適で、フライト中の暇つぶしにピッタリだったので、次回のフライトもぜひ使いたいと思いました。また、音楽のプレイリストが豊富で、リラックスできる時間を提供してくれました。次回も楽しみにしています。しかし、荷物を受け取る際、他の乗客との混雑でぶつかり合いがありましたが、スタッフは対応せず、誰も問題を解決しなかったので、もっと注意深く運営してほしいと思いました。,-,快適な機内Wi-Fiでフライト中の暇つぶしができ、豊富な音楽プレイリストでリラックスできる時間を過ごせました。,快適な機内Wi-Fiがフライト中の暇つぶしにピッタリで、次回のフライトでもぜひ利用したいと思った。,-,-,-,-,-,-,-,-,荷物受取時に乗客同士がぶつかり合う混雑があったのに、スタッフは対応せず問題解決しなかった。,荷物受け取り時の混雑でぶつかり合いがあったのに、スタッフは対応せず問題解決をしなかった。,-,B830-10,2025-03-06,HND-LHR,Premium Economy,True,4,3,3,3,4,3,3,3
41,82,2025-03-13,今回初めて利用したこの航空会社は、全体的に期待していたサービスとは異なりました。まず、座席が古くてあまり清潔感がありませんでした。座ったときにちょっとした不快感があり、さらにリクライニングもほとんど倒れずリラックスできませんでした。改善を強く希望します。一方で、空港内で小さな問題が発生した際、スタッフがすぐに気づいて声をかけてくれたことは感動的で、安心感を得ることができました。,-,-,-,-,空港内で小さな問題が発生した際、スタッフがすぐに気づいて声をかけてくれたことで安心感を得られました。,-,-,-,-,-,-,-,-,座席が古く清潔感がなく、座ると不快感があり、リクライニングもほとんど倒れないためリラックスできなかった。,B905-12,2025-03-12,NRT-CDG,First Class,True,3,3,3,3,4,4,4,4
42,65,2025-04-17,私は普段あまり海外旅行に行く機会がないので、今回は贅沢にビジネスクラスでロサンゼルスへ行きました。高額な料金を支払ったにもかかわらず、機内食やサービスに不満があり、全体的にコスパが悪いと感じました。しかしフライト中にオンラインで映画を観たかったが、Wi-Fiの接続がとても速く快適に視聴でき、長時間のフライトでも全く問題ありませんでした。,-,Wi-Fiの接続が非常に速く、長時間のフライトでも映画を快適に視聴できました。,Wi-Fiの接続が非常に速く、長時間フライト中でも映画を快適に視聴できました。,-,-,-,-,高額なビジネスクラス料金に見合わない機内食のクオリティに不満を感じました。,高額なビジネスクラス料金に見合わない機内食のクオリティに不満を感じました。,-,高額なビジネスクラス料金を支払ったのに、機内食やサービスが期待に見合わず、全体的にコストパフォーマンスが悪かった。,-,-,-,E180-E2,2025-04-16,HND-CTS,Economy Class,False,4,4,4,3,3,5,4,3
43,73,2025-04-14,先日は海外赴任先から家族に会うために利用しました。座席の後ろに座っていた乗客が体調不良になった際、スタッフがすぐに動き出し、冷静に適切な対応をしたので私も安心して過ごせました。しかし他の航空会社に比べて料金が高いにも関わらず、サービスのクオリティが低いと感じたため、次回はもっとコスパの良い航空会社を選ぶかもしれません。実際、高額な料金を支払った割には、座席の快適さも中途半端で、他の航空会社と大差なく、コスパが悪かったです。,-,-,-,-,-,体調不良の乗客がいた際、スタッフが迅速かつ冷静に適切な対応をしてくれたので安心して過ごせました。,-,-,-,-,高額な料金を支払ったにもかかわらず、座席の快適さが中途半端で他社と大差なく、サービスのクオリティも低いためコスパが悪かった。,-,-,高額な料金を支払った割には座席が中途半端で他社と大差なく、コスパが悪かった。,S385-TP,2025-04-12,HND-LHR,First Class,False,3,3,3,4,3,4,5,3
44,41,2025-03-24,最近、海外旅行でよく飛行機を利用するようになった。特に国際線は長時間になることが多いので、機内でのサービスはとても重要だ。先日利用した航空会社では、機内食の選択肢が豊富で、いろんな国の料理を楽しめたのが嬉しかった。フライト中に異文化を味わうことができ、旅行のワクワク感がさらに高まった。しかし、エンターテイメントに関しては少し残念な点があった。映画を楽しもうと思ったが、英語字幕が不完全で、ストーリーを十分に理解できなかった。字幕の品質をもっと向上させてほしい。,機内食の選択肢が豊富で様々な国の料理を楽しめ、フライト中に異文化を味わえたことで旅行の高揚感が増した。,-,-,-,-,-,-,-,-,-,-,-,-,-,A430-200,2025-03-23,NRT-LHR,Premium Economy,True,4,3,3,4,3,3,3,3
45,54,2024-12-12,先日は初めて海外旅行でアメリカへ行きました。普段は仕事で忙しいので、長距離フライトは大変疲れるのですが、今回利用した航空サービスはとても快適でした。機内のWi-Fi接続が非常に安定していて、快適に映画や動画を楽しめました。次回も利用したいです。機内食も良かったです。飲み物の種類が多く、どれも美味しくてリフレッシュできました。特に機内でのフルーツジュースはとても美味しかったです。,機内食が良く、特に種類豊富な飲み物はどれも美味しくてリフレッシュでき、フルーツジュースは特に美味しかった。,機内のWi-Fi接続が非常に安定していて、映画や動画を快適に楽しむことができました。,機内のWi-Fi接続が非常に安定していて、快適に映画や動画を楽しめました。,-,-,-,-,-,-,-,-,-,-,-,E260-E3,2024-12-11,HND-LHR,Premium Economy,True,5,5,4,3,4,4,3,4
46,104,2025-04-23,先日、60代の父を伴う家族旅行で飛行機を利用しました。機内エンターテイメントの操作が難しく、メニューもアイコンも小さくて読みにくかったため、父は操作を諦めて窓側で腕組みをしていました。残りのフライト時間があと8時間もあると言うと、ため息をつかれていました。また、コンテンツの読み込みが非常に遅く、乗り物酔いしていた私は、待たされるのが辛かったです。,-,-,-,-,-,-,-,-,-,コンテンツの読み込みが非常に遅く、乗り物酔いしている状態では特に辛かったです。,-,-,-,-,E180-E2,2025-04-22,HND-SFO,Economy Class,False,2,2,4,4,3,3,3,4
47,10,2025-03-23,最近、海外旅行で長時間のフライトを利用しました。私は仕事の関係で頻繁に海外を訪れるため、機内での快適さは非常に重要です。今回のフライトでは、機内食が単調で同じメニューが繰り返し出されて飽きてしまいました。もっとバラエティに富んだメニューが欲しいと思いました。また、長時間座っていると座席が硬く感じられ、腰が痛くなりました。しかし、フライト後に空港スタッフが私の荷物を早急に手配してくれて、他の乗客と比べてスムーズに荷物を受け取ることができました。スタッフの気配りが素晴らしかったです。,-,-,-,-,空港スタッフが荷物を早急に手配してくれたおかげで、他の乗客よりもスムーズに受け取ることができ、その気配りに感謝しています。,-,-,機内食が単調で同じメニューが繰り返し出され、もっとバラエティに富んだメニューが欲しいと感じた。,機内食が単調で同じメニューが繰り返し出され、もっとバラエティに富んだメニューが欲しいと感じた。,-,-,-,-,長時間座っていると座席が硬く感じられ、腰が痛くなりました。,A390-100,2025-03-22,HND-SFO,Economy Class,False,3,4,1,3,3,4,4,4
