review_id,user_id,review_date,review,pos_food_and_beverages_summary,pos_inflight_entertainment_summary,pos_wifi_connectivity_summary,pos_value_for_money_summary,pos_ground_service_summary,pos_cabin_staff_service_summary,pos_seat_comfort_summary,neg_food_and_beverages_summary,neg_inflight_entertainment_summary,neg_wifi_connectivity_summary,neg_value_for_money_summary,neg_ground_service_summary,neg_cabin_staff_service_summary,neg_seat_comfort_summary,flight_id,flight_date,route_id,seat_type,is_recommended,rating_overall,rating_seat_comfort,rating_cabin_staff_service,rating_ground_service,rating_value_for_money,rating_food_beverages,rating_ife,rating_wifi_connectivity
80,62,2025-03-01,先日初めて海外に行く機会があり、ワクワクしながら飛行機に乗った。私は映し出される映画を楽しみにしていたが、字幕が小さくて視覚的に非常に疲れました。もう少し大きくしてほしいです。機内食は事前に選択できたので、事前に登録したメニューで注文したが、食事を頼んだ時、私のアレルギーについて尋ねられることなく、アレゲンが含まれているものが出されてしまった。もっと配慮が必要だと感じた。,事前にメニューを選択できた。,映画の字幕が小さくて視覚的に疲れたので、もっと大きくしてほしい。,-,-,"-
このレビューにはポジティブで「地上サービス」に該当する内容はありません。",-,-,アレルギーに関する事前確認がなく、アレルゲンが含まれた食事が出されたので、もっと配慮が必要だ。,アレルギーに関する事前確認がなく、アレルゲンが含まれた食事が出されたので、もっと配慮が必要だ。,-,アレルギーに関する配慮が不足していた割に、料金を払っているだけの価値は感じられなかった。,アレルギーに関する事前情報が反映されておらず、アレルゲンが含まれる食事が出された。,アレルギーに関する配慮が欠けていたため、アレルゲンが含まれた食事が出された。,字幕が小さくて視覚的に非常に疲れたので、もっと大きくしてほしい。,B830-10,2025-02-28,NRT-LHR,Business Class,False,4,3,5,5,6,6,2,5
82,32,2024-11-25,先日利用した際、機内のスタッフがやたらと無愛想で何かお願いするたびに不機嫌そうな顔をされて嫌な思いをした。空港に着いてからもVIPラウンジを利用したが、予想以上に混雑しており、席はいっぱいで、スタッフが座席の案内をしてくれなかった。長時間立っているしかなく、疲れた。航空会社として、もう少し笑顔と心遣いを大事にしてほしい。私は出張とプライベートで月に数回飛行機を利用するが、今回のような経験は初めてだった。,-,-,-,-,VIPラウンジは予想以上に混雑しており、スタッフが座席の案内をしてくれなかったため、長時間立っているしかなかった。,-,-,-,-,-,VIPラウンジが混雑していたにも関わらずスタッフが適切な案内をしてくれず、長時間立っていなければならなかったのが残念だった。,空港に着いてから利用したVIPラウンジは、予想以上に混雑しており、スタッフが席の案内をしてくれなかったため、長時間立っていなければならなかった。,機内で何かお願いするたびにスタッフが不機嫌そうな顔をし、無愛想だった。,VIPラウンジは混雑していて席がなく、スタッフが座席の案内をしてくれなかったため、長時間立っていなければならなかった。,A430-200,2024-11-24,NRT-SIN,Economy Class,False,2,5,6,5,6,5,3,3
83,56,2025-04-09,最近、家族で海外旅行に行った際、初めてこの航空会社のサービスを利用しました。普段は仕事で頻繁に飛行機を利用しているのですが、家族での旅行は初めてで、子どもが機内でぐずり始めたときにどうなるか心配でした。しかし、スタッフがすぐにおもちゃや絵本を持ってきてくれたので、とても助かりました。予想以上に気配りが行き届いていて、感謝しています。ただ、普段の仕事で利用するWi-Fiがあまりにも不安定で、接続中に何度も切れてしまい、仕事が全然進まなかったのが残念でした。他の航空会社と比較しても最悪だったと思います。,-,子どもが機内でぐずり始めた際に、スタッフがおもちゃや絵本を持ってきてくれたので、とても助かりました。,"-

（レビューからは「機内Wi-Fiと接続性」に関するポジティブな内容は抽出できず、代わりに不満が述べられているため、「-」と回答する）",家族への気配りが行き届いたサービスに感謝している。,子どもが機内でぐずり始めた際に、スタッフがすぐにおもちゃや絵本を持ってきてくれたので、とても助かりました。,子どもが機内でぐずり始めた際に、スタッフがすぐにおもちゃや絵本を持ってきてくれたので、気配りが行き届いていて助かりました。,機内での子どもの対応が素晴らしく、気配りが行き届いていた。,-,-,普段仕事で利用するWi-Fiがあまりにも不安定で、接続中に何度も切れてしまい、仕事が全然進まなかった。,Wi-Fiが不安定で接続中に何度も切れてしまい、仕事が進まなかったのは残念で、他の航空会社と比べても最悪だった。,Wi-Fiが不安定で接続中に何度も切れてしまい、仕事が進まなかった。,"機内で子どもがぐずり始めた際、スタッフがすぐにおもちゃや絵本を持ってきてくれたので助かった。 

→ 該当する内容がないため、""-"" と回答するのが正解です。

-

(正しくは、ネガティブな内容でかつ「客室スタッフのサービス」についての記述がないため、「-」と回答するのが適切です。)",-,B845-9,2025-04-08,NRT-SIN,First Class,True,8,6,5,7,7,2,9,7
84,72,2024-12-02,先日は初めて海外旅行でアメリカに行ってきました。友人の結婚式に出席するため、急遽航空券を取ったのですが、コスパの良い航空会社を探した結果、この航空会社に決めました。映画も機内で楽しみたかったので期待していたのですが、映画を選ぶ際にジャンルごとに絞り込む機能がないので、見たい映画を探すのに時間がかかりすぎました。高額な料金を支払ったが、座席の快適さも中途半端で、他の航空会社と大差なく、コスパが悪かった。,-,映画も機内で楽しみたかったのですが、期待していたほどではなかったです。,-,コスパの良い航空会社を探した結果、この航空会社に決めました。,-,-,-,-,-,映画を選ぶ際にジャンルごとに絞り込む機能がないので、見たい映画を探すのに時間がかかりすぎた。,高額な料金を支払った割には、座席の快適さが他の航空会社と大差なく、コスパが悪かった。,映画を選ぶ際にジャンルごとに絞り込む機能がないので、見たい映画を探すのに時間がかかった。,"-
このレビューには「客室スタッフのサービス」に関するネガティブな内容は含まれていません。",高額な料金を支払った割には、他の航空会社と大差なく感じられた。,A392-300,2024-12-01,HND-ITM,Premium Economy,False,4,3,7,7,3,5,6,6
85,4,2024-11-16,先日利用した航空サービスは全体的に良かった。まず、機内でのWi-Fi接続が非常にスムーズで、フライト中も仕事が進められて助かった。私はIT企業のエンジニアで、海外クライアントとの打ち合わせが頻繁にあり、飛行中のインターネット接続は必須だ。特にプログラミングをしていたので、スピーディな接続は重要だった。しかし、チェックイン時にはトラブルに見舞われた。誤って航空券が無効にされてしまい、スタッフのミスで余計な手間がかかった。航空券確認をもっと慎重に行ってほしいと思う。一方、空港内での案内がとても分かりやすく、迷わずゲートに到着できたのは助かった。スタッフがあらかじめ詳細な情報を提供してくれたので、安心してフライトを楽しめた。,-,機内でのWi-Fi接続がスムーズで、フライト中も仕事が進められて助かった。,機内Wi-Fi接続がスムーズで、フライト中も仕事が進められて助かった。,機内でのスムーズなWi-Fi接続により、フライト中も仕事が進められ、特にプログラミング作業に大変役立った。,空港内での案内が分かりやすく、スタッフが詳細な情報を事前に提供してくれたので、安心してゲートに到着できた。,機内でのWi-Fi接続がスムーズで、仕事が進められて助かった。,-,-,-,-,チェックイン時に航空券が無効にされたことで余計な手間がかかり、スタッフのミスに対する追加の対応を求められた。,チェックイン時に航空券が無効にされるトラブルがあり、スタッフのミスで余計な手間がかかった。,チェックイン時にスタッフのミスで航空券が無効にされてしまい、余計な手間がかかった。,-,B905-12,2024-11-15,NRT-LHR,Business Class,True,8,7,7,5,7,10,7,2
86,58,2024-12-07,今回の航空会社のサービスには全体的に非常に満足しました。料金は少し高いと感じましたが、機内サービスや座席の快適さ、エンタメが素晴らしかったです。実際、私は事前に機内食のリクエストをしていたのですが、スタッフはしっかり覚えていて、私が希望した食事を提供してくれました。こうした配慮が本当にありがたかったです。ただ、他の航空会社と比較すると料金が高いのは事実で、次回はよりリーズナブルな選択肢を選ぶかもしれませんが、フライト中の体験は期待通りでした。,事前にリクエストした機内食を覚えていてくれて提供してくれたスタッフの配慮がありがたかった。,エンタメが素晴らしかったです。,-,機内サービスや座席の快適さ、エンタメが素晴らしく、スタッフの配慮もあったため、料金に見合った価値があった。,事前にリクエストした機内食を覚えていてくれて希望通りの食事を提供してくれたスタッフの配慮がありがたかった。,事前にリクエストした機内食をしっかり覚えていて提供してくれたスタッフの配慮が本当にありがたかったです。,機内サービスや座席の快適さが素晴らしかったです。,-,-,-,料金は少し高いと感じたが、機内サービスや座席の快適さに見合っていたため、フライト中の体験は期待通りだった。,-,-,-,B905-12,2024-12-06,HND-SFO,Premium Economy,True,8,7,7,7,3,7,7,9
87,91,2024-11-20,私は普段、フリーランスで仕事をしており、海外クライアントとのやり取りが多いため、飛行機の中でも作業をすることが多いです。最近利用した航空会社では、ネット接続サービスを利用しましたが、途中で接続が切れてしまい、作業が進まず大変困りました。お金を払って利用する価値が全く感じられなかったです。また、座席は隣との間隔が狭く、他の乗客との接触が気になりました。もう少しスペースが欲しいと思いました。,-,-,-,-,-,-,-,-,-,途中で接続が切れてしまい、作業が進まなかった。,お金を払って利用するネット接続サービスが途中で切れてしまい、作業が進まなかったので価値が感じられなかった。,ネット接続サービスが途中で切れてしまい、お金を払う価値が感じられなかった。,ネット接続サービスが途中で切れてしまい、作業が進まなかった。,隣との間隔が狭く、他の乗客との接触が気になった。,A430-200,2024-11-19,NRT-LHR,Economy Class,False,2,5,4,7,6,2,7,6
88,89,2025-03-26,先月、久しぶりに海外旅行でアメリカに行った。現地で仕事の連絡を取る必要があったので、飛行機内でのWi-Fi接続を予約していた。ところが、つながりにくく、結局ほとんど使えなかった。仕方がないので、オフラインの時間を過ごすことを余儀なくされた。次にまた海外に行く機会があったら、別の航空会社を利用したいと思った。先週、今度は国内線で予約した飛行機に乗った。飛行機内でソーシャルメディアをチェックしながら、旅行先の情報を調べるのにWi-Fiがすぐに繋がり、非常に便利だった。やっぱり、機内Wi-Fiはあると助かるなと再認識した。,-,国内線の飛行機では、Wi-Fiがすぐに繋がり、ソーシャルメディアのチェックや旅行先の情報調べに便利だった。,国内線ではWi-Fiがすぐに繋がり、ソーシャルメディアのチェックや旅行先の情報調べに非常に便利だった。,国内線の機内Wi-Fiがすぐに繋がり、ソーシャルメディアのチェックや旅行先の情報収集に役立ったので、あると助かるサービスだと思った。,国内線の飛行機では、機内Wi-Fiがすぐに繋がり、ソーシャルメディアのチェックや旅行先の情報調べに非常に便利だった。,-,-,-,-,アメリカに行った際、飛行機内のWi-Fiがつながりにくく、ほとんど使えなかった。,海外旅行で利用した際、つながりにくくほとんど使えなかったので、次回海外に行く際は別の航空会社を利用したいと思った。,国際線の飛行機内でWi-Fiがつながりにくく、ほとんど使えなかった。,-,-,E190-E2X,2025-03-25,HND-SFO,Premium Economy,False,5,5,5,7,6,9,7,5
90,77,2024-12-13,先月、家族と一緒に日本からハワイへ旅行した際、利用した航空会社のサービスに大変満足しました。現地情報が非常に役立ち、観光地やレストランの選択肢が広がり、旅行がより充実しました。また、フライト中に気流の乱れがありましたが、乗務員がすぐに冷静に対処してくれ、乗客全員に安心感を与えてくれた。非常に頼もしいと感じました。さらに、機内の飲み物サービスがこまめで、長時間のフライトでも喉が乾くことがなかったので、家族も大変喜んでおりました。全体的に大変満足です。,機内の飲み物サービスがこまめで、長時間のフライトでも喉が乾くことがなかった。,現地情報が非常に役立ち、観光地やレストランの選択肢が広がり、旅行がより充実しました。,-,全体的に大変満足です。,現地情報が非常に役立ち、観光地やレストランの選択肢が広がり、旅行がより充実しました。,気流の乱れの際に乗務員が冷静に対処してくれたことで安心感を得られ、また飲み物サービスがこまめで長時間のフライトでも喉が乾くことがなかった。,機内の飲み物サービスがこまめで、長時間のフライトでも喉が乾くことがなかった。,-,-,-,-,-,フライト中に気流の乱れがありましたが、乗務員がすぐに冷静に対処してくれたので、問題ありませんでした。,-,A470-900,2024-12-12,HND-SFO,Premium Economy,True,9,9,6,8,7,5,10,6
91,26,2025-04-24,先月、久しぶりに海外旅行でアメリカに行くために羽田空港で飛行機に乗りました。約10時間の長距離フライトでしたが、背もたれが調整可能で、自分に合った角度にできるので非常に快適でした。しかし、トイレの清掃が不十分で、使用後に不快な思いをした。空港のスタッフが清掃の頻度をもっと増やすべきだと感じた。,-,-,-,背もたれが調整可能で自分に合った角度にできるので、約10時間の長距離フライトでも非常に快適だった。,空港スタッフによる清掃の頻度をもう少し増やしてほしい。,背もたれが調整可能で自分に合った角度にできるので、約10時間の長距離フライトでも非常に快適だった。,背もたれが調整可能で自分に合った角度にできるので、約10時間の長距離フライトでも非常に快適だった。,-,-,-,トイレの清掃頻度が低く不快な思いをしたので、改善してほしい。,トイレの清掃が不十分で不快な思いをしたため、清掃の頻度をもっと増やすべきだ。,トイレの清掃頻度が低く、使用後に不快な思いをした。,"-
（レビュー内容に「座席の快適さ」に関するネガティブな内容がないため）",A470-900,2025-04-23,NRT-LHR,Premium Economy,True,7,6,9,7,7,5,7,3
92,69,2025-04-03,最近、仕事の都合で海外出張が増え、毎月数回は飛行機を利用しています。普段からなるべく健康に気を使おうと思っているので、飛行機の中でも食事に気をつけるようにしています。先日のフライトでは、空港のラウンジを利用させてもらいましたが、清掃が行き届いており快適に過ごせました。スタッフの細やかな気配りも嬉しかったです。ただ、機内食は残念でした。ダイエット中なので低カロリーの食事を頼んだのですが、提供された食事が全く低カロリーでなく、選択肢の無さにがっかりしました。,空港ラウンジでのサービスは、清掃が行き届いており、スタッフの細やかな気配りもあった。,-,-,空港ラウンジが快適に過ごせた。,空港ラウンジは清掃が行き届いており、スタッフの細やかな気配りもあった。,空港ラウンジでスタッフの細やかな気配りを感じ、快適に過ごせました。,空港のラウンジは清掃が行き届いており快適に過ごせた。,ダイエット中で低カロリーの食事を頼んだが、提供された食事が全く低カロリーでなく、選択肢の無さにがっかりした。,ダイエット中で低カロリーの食事を頼んだが、提供された食事が全く低カロリーでなく、選択肢の無さにがっかりした。,-,低カロリーの食事を頼んだが、全く低カロリーでない食事が提供され、選択肢の無さにがっかりした。,空港ラウンジの清掃は行き届いており、スタッフの気配りも良かった。,機内食で低カロリーの食事を頼んだが、全く低カロリーではない食事が提供され、選択肢の無さにがっかりした。,-,B830-10,2025-04-02,HND-CTS,Business Class,True,7,5,5,2,7,5,6,8
93,81,2025-03-06,先日はシドニーへの出張で、長時間のフライトを利用しました。普段はエコノミークラスで我慢していますが、今回は会社の都合でプレミアムエコノミーを選択しました。足元が狭すぎて、長時間のフライトではかなり窮屈に感じました。改善が必要です。機内エンターテイメントは楽しみにしていたのですが、コンテンツの読み込みが非常に遅く、乗り物酔いしている最中に待たされるのが辛かったです。,-,コンテンツの読み込みが遅くて楽しめなかった。,-,-,-,-,-,-,-,コンテンツの読み込みが遅くて辛かった。,プレミアムエコノミーの足元の狭さや機内エンターテイメントの読み込みの遅さに改善の余地を感じ、追加料金に見合う価値が得られなかった。,-,-,足元が狭すぎて、長時間のフライトではかなり窮屈に感じた。,A430-200,2025-03-05,HND-LHR,Premium Economy,False,4,2,3,7,6,7,6,7
94,48,2024-11-12,私は普段から出張でBricks Airwaysを利用しています。先日の出張では価格が高くて、サービスや座席の快適さがそれに見合わなかったので少し残念でした。支払った金額が無駄に思えたのですが、乗っている間に観た映画が非常に面白く、退屈しらずでした。実際機内でのインターネット接続が速く、ビジネスでの打ち合わせをスムーズにこなすことができたので非常に便利だったので、次回もBricks Airwaysを利用したいです。,-,映画が面白くて退屈しなかった。,インターネット接続が速く、ビジネスでの打ち合わせをスムーズにこなすことができて非常に便利だった。,機内でのインターネット接続が速く、ビジネスでの打ち合わせをスムーズにこなすことができたので、非常に便利だった。,機内でのインターネット接続が速く、打ち合わせをスムーズにこなすことができて便利だった。,-,-,サービスや座席の快適さが価格に見合わなかった。,サービスや座席の快適さが価格に見合わなかった。,-,料金に見合ったサービスや座席の快適さではなかった。,価格が高くてサービスや座席の快適さがそれに見合わなかった。,価格に見合ったサービスではなかった。,価格に見合った快適さではなかった。,S360-TP,2024-11-11,HND-ITM,Business Class,True,8,9,7,7,3,9,6,5
95,41,2025-04-06,私は普段から仕事で海外を飛び回っているが、最近利用した航空会社のサービスには残念な思いをした。料金が高い割に、座席の広さやリクライニングの機能に不満があり、長時間のフライトには不向きだと思った。実際長時間座っていると座席が硬く感じ、腰が痛くなった。また、長時間フライトで何度も飲み物をお願いしたが、やっと持ってきた飲み物が冷たすぎて、結局飲めなかった。サービスのクオリティに一貫性がないと感じた。,-,-,-,-,-,-,-,長時間フライトで何度もお願いした飲み物が、やっと持ってきた時には冷たすぎて飲めなかった。,長時間フライトで何度もお願いした飲み物が、やっと持ってきた時には冷たすぎて飲めなかった。,-,料金が高い割に座席の広さやリクライニング機能が不十分で長時間のフライトに不向きだった。,長時間のフライトで何度も飲み物をお願いしたが、やっと持ってきた飲み物が冷たすぎて飲めなかった。,飲み物を何度も頼んだが、持ってきた飲み物が冷たすぎて飲めず、サービスのクオリティに一貫性を感じなかった。,料金が高い割に座席が硬く長時間のフライトには不向きで、実際長時間座っていると腰が痛くなった。,E190-E2X,2025-04-05,NRT-SIN,First Class,False,2,5,3,5,3,5,3,5
96,54,2025-01-11,先日は海外旅行で初めてビジネスクラスを利用しました。普段はエコノミークラスを利用することが多いのですが、今回は特別な旅行だったので奮発してビジネスクラスにしました。高いチケット代に見合うだけの価値があり、特に座席の広さとエンタメの質が素晴らしかったです。料金が高いと言われていますが、それに見合った素晴らしいサービスと快適なフライト体験ができ、納得できました。また、フライト中に簡単にネットにアクセスでき、事前に確認したいことも問題なく調べられて非常に便利でした。,-,エンタメの質が素晴らしかったです。,フライト中に簡単にネットにアクセスでき、事前に確認したいことも問題なく調べられて非常に便利でした。,高いチケット代に見合うだけの価値があり、納得できた。,-,高いチケット代に見合うだけの価値があり、素晴らしいサービスだった。,高いチケット代に見合うだけの価値があり、特に座席の広さが素晴らしかったです。,-,-,-,-,-,-,-,A392-300,2025-01-10,HND-SFO,Economy Class,True,9,6,7,6,9,8,5,5
