review_id,user_id,review_date,review,pos_food_and_beverages_summary,pos_inflight_entertainment_summary,pos_wifi_connectivity_summary,pos_value_for_money_summary,pos_ground_service_summary,pos_cabin_staff_service_summary,pos_seat_comfort_summary,neg_food_and_beverages_summary,neg_inflight_entertainment_summary,neg_wifi_connectivity_summary,neg_value_for_money_summary,neg_ground_service_summary,neg_cabin_staff_service_summary,neg_seat_comfort_summary,flight_id,flight_date,route_id,seat_type,is_recommended,rating_overall,rating_seat_comfort,rating_cabin_staff_service,rating_ground_service,rating_value_for_money,rating_food_beverages,rating_ife,rating_wifi_connectivity
22,13,2024-12-15,先日は初めて海外旅行でアメリカへ行きました。普段は割引を狙ってLCCを利用することが多いのですが、今回は贅沢をして普段使わないフルサービスの航空会社を利用しました。価格に見合った素晴らしい体験を提供してくれた。座席の広さやサービスが全て素晴らしく、快適なフライトだった。しかし、機内エンターテイメントは残念でした。短時間でも接続が切れるので、オンラインで映画を観ることができず、非常に不満だった。また機内のゲームも全く面白くなく、退屈していました。もっとエンタメ性の高いゲームを導入してほしいです。,価格に見合った素晴らしい体験だった。,"-

（注：元の指示に従い、ポジティブかつ「機内エンターテイメント」に該当する内容は存在しないため、「-」と回答しています。）",接続が切れることがあり不満だった。,価格に見合った素晴らしい体験だった。,価格に見合った素晴らしい体験だった。,価格に見合った素晴らしいサービスで、座席の広さも含めて快適なフライトだった。,座席の広さが素晴らしく、快適なフライトだった。,-,-,短時間でも接続が切れるので、オンラインで映画を観ることができず、非常に不満だった。,機内エンターテイメントの接続不良やゲームの面白みに欠けるところが、価格に見合わない部分だった。,-,機内エンターテイメントの接続不良やゲームの面白みに欠けていた点が不満だった。,機内エンターテイメントの接続が切れたり、ゲームが面白くなかったりとエンタメ性に欠け、退屈だった。,A425-900,2024-12-14,NRT-LHR,Premium Economy,True,8,2,7,7,9,3,6,5
23,23,2025-04-21,最近、家族で海外旅行に行くためにこの航空会社を利用しました。私は映画鑑賞が趣味で、長距離フライスは楽しみにしていたのですが、乗務員が細かいところまで気を配ってくれ、映画を観るために快適な場所に座れるようにサポートしてくれたので、とても快適に過ごすことができました。しかし、機内の温度が寒すぎたのでブランケットをお願いしたが、スタッフはすぐに持ってきてくれなかった。寒い中で何度も頼んだが、やっと届いたのはフライトの終盤だった。料金が高いわりにはサービスのクオリティが低いと感じたので、次回はもっとコスパの良い航空会社を選ぶかもしれない。,-,乗務員が映画を快適に観られるように配慮してくれたので、長距離フライトを楽しむことができました。,-,料金が高いわりにはサービスのクオリティが低いと感じた。,乗務員が細かいところまで気を配ってくれ、映画を観るために快適な場所に座れるようにサポートしてくれた。,映画を観るために快適な場所に座れるよう、乗務員が細かいところまで気を配ってサポートしてくれた。,乗務員が細かいところまで気を配ってくれ、映画を観るために快適な場所に座れるようにサポートしてくれたので、とても快適に過ごすことができました。,ブランケットの提供が遅く、寒い思いをした。,ブランケットの提供が遅く、寒い思いをした。,-,料金が高いわりにはサービスのクオリティが低いと感じた。,"-

理由：顧客レビューに記載されている内容は全て機内サービスに関するものであり、「地上サービス」に関するネガティブな内容は含まれていないため、「-」と回答する。",ブランケットの提供が遅く、何度も頼まなければならなかった。,機内の温度が寒すぎてブランケットを頼んだが、なかなか届かなかった。,B830-10,2025-04-20,HND-LHR,Premium Economy,False,6,7,6,6,3,7,8,5
24,62,2025-03-09,先日は初めての海外旅行で、家族と一緒に成田からシドニーへ行くのに利用しました。長時間のフライトで座席に座っていると肩が凝りやすかったので、もっと快適なシートにしてほしいと思いました。空港に着いてみるとセキュリティチェックで何度も並ばされて、待機時間が長くて乗り継ぎ時間がギリギリになってしまいました。スタッフはあまり手際よく動かず、もっとスムーズな運営を望みました。,-,-,-,-,-,-,-,-,-,-,長時間のフライトで不快な思いをした上に、セキュリティチェックで何度も並ばされて時間を無駄にしたので、もっとサービスを充実させてほしい。,セキュリティチェックで何度も並ばされて待機時間が長かったので、もっとスムーズな運営をしてほしかった。,スタッフはあまり手際よく動かず、もっとスムーズな運営を望みました。,長時間のフライトで肩が凝りやすかったので、もっと快適なシートにしてほしいと思いました。,S450-XLR,2025-03-08,HND-ITM,Economy Class,False,4,5,4,5,6,6,7,3
25,61,2025-04-28,最近、仕事でアメリカに行く機会があって、初めてこちらの航空会社を利用しました。普段から映画をよく見るので、ストリーミングサービスが楽しめるのは嬉しかったです。ブラウザ上でのストリーミングがスムーズで、何も気にせず映画を楽しむことができました。客室乗務員が機内で話しかけてきたが、質問に対してあまり親切に答えてくれなかった。自分の要望をしっかり聞いてくれると、もっと安心できた。価格が高いにも関わらず、Wi-Fiが遅くて使い物にならなかった。商談の準備ができると思っていたのに、結局まともにネットを使えず、非常に不便だった。,-,ストリーミングサービスが楽しめることやブラウザ上でのストリーミングがスムーズだったことが嬉しかった。,ストリーミングサービスがスムーズに楽しめた。,ストリーミングサービスが楽しめたのは嬉しかった。,ストリーミングサービスが楽しめることと、ブラウザ上でのストリーミングがスムーズだったことが嬉しかった。,客室乗務員が機内で話しかけてきたが、質問に対してあまり親切に答えてくれなかった。,ブラウザ上でのストリーミングがスムーズで、映画を楽しむことができました。,-,-,価格が高いにも関わらず、Wi-Fiが遅くて使い物にならなかった。,高い価格にも関わらずWi-Fiが遅くて使い物にならなかった。,客室乗務員が質問に対して親切に答えてくれず、要望をしっかり聞いてくれなかった。,客室乗務員が質問に対してあまり親切に答えてくれず、自分の要望をしっかり聞いてくれなかったのが残念だった。,客室乗務員が質問に対して親切に答えてくれなかったため、要望をしっかり聞いてもらえず不満だった。,E260-E3,2025-04-27,NRT-CDG,Business Class,False,6,9,6,7,7,2,3,7
26,31,2025-01-31,最近、リモートワークで忙しく、久しぶりに海外出張で飛行機を利用しました。空港に着いてまず思ったのは、空港内のトイレが使用不可になっていたことです。スタッフからの事前の知らせがなく、利用する際に不便でした。案内が不足していると感じました。しかし、機内に入ると、リモートワークができる環境が整っていて助かりました。フライト中でも仕事ができるのは非常に助かり、Wi-Fi接続もスムーズでストレスなく作業を進められました。,-,リモートワークができる環境が整っており、Wi-Fi接続もスムーズでストレスなく作業を進められた。,フライト中でもWi-Fi接続がスムーズで、ストレスなく作業を進められたのが助かりました。,機内でリモートワークができる環境が整っており、Wi-Fi接続もスムーズだったので、フライト中でもストレスなく作業を進められた。,"-

（理由：ポジティブな「地上サービス」に関する記述が存在しないため。空港のトイレが使用不可であったことに関する記述はネガティブな内容であるため。） 
→ 修正後：-
（上記理由を省き、単に「-」とだけ出力）",機内でリモートワークができる環境が整っており、Wi-Fi接続もスムーズで作業が進めやすかった。,機内でリモートワークができる環境が整っていたため、フライト中でもスムーズに作業を進めることができた。,-,-,Wi-Fi接続はスムーズでストレスなく作業を進められた。,空港内のトイレが使用不可だった際の事前案内がなく不便だったが、料金に見合うサービスだったかは不明。,空港のトイレが使用不可だった際、事前のスタッフからの案内がなく不便だった。,空港到着時のトイレ使用不可について、事前にスタッフから知らせがなく不便だった。,-,A470-900,2025-01-30,HND-LHR,First Class,True,7,7,7,6,7,9,6,3
28,38,2024-11-14,先日初めて海外旅行で海外の航空会社を利用しました。私は腰が悪くて長時間のフライトが心配でしたが、期待したほどの快適さは得られませんでした。座席に座っていると、長時間で腰が痛くなります。もっと快適に座れるシートが必要です。フライト中はスタッフが何度も間違えて注文を取ったり、提供したりしたので驚きました。少しの手間でサービスの品質が向上するのに、もったいなかったです。搭乗前から気になっていたのですが、スタッフが忙しすぎるのか、笑顔や配慮を全く感じられなかったのも残念でした。忙しい中でも最低限の礼儀や気配りをしてほしいと思いました。,"-

レビュー内に「食事と飲み物」に関するポジティブな内容は存在しなかったため、「-」と回答します。",-,-,-,-,"-

レビューにポジティブな内容は含まれていません。 

ただし、厳守事項に従い、ポジティブな内容が存在しない場合は「-」と回答することになっているため、以下が出力です。

-",-,フライト中にスタッフが何度も注文を間違えて取ったり、提供したりしたのが残念だった。,フライト中にスタッフが何度も注文を間違えて取ったり、提供したりしたのが残念だった。,-,長時間のフライトにもかかわらず、期待したほどの快適さが得られなかったので、もっと快適に座れるシートが必要だと思う。,搭乗前にすでに感じていたこととして、スタッフの笑顔や配慮を感じられず、忙しい中でも最低限の礼儀や気配りをしてほしかった。,フライト中に注文を何度も間違えられ、また忙しそうでスタッフの笑顔や配慮も感じられなかったので、最低限の礼儀や気配りをしてほしかった。,長時間座っていると腰が痛くなるので、もっと快適に座れるシートが必要です。,S360-TP,2024-11-13,HND-LHR,First Class,False,4,6,3,7,7,6,3,6
29,84,2025-03-21,初めて利用した空港だったので到着時には少し不安を感じていたが、スタッフの方が非常に親切でスムーズに案内してくれた。わかりやすく迅速に対応してくれたので安心してフライトを楽しむことができた。出発からかなりの時間が経過しても食事が提供されず結局降りる寸前に出されて急いで食べるはめになったがフライト中急な変更に対応してくれたスタッフの迅速な対応には感謝している。大きな不安を感じることなくフライトを終えることができたのでもっと計画的に食事を提供してほしい。,もっと計画的に食事を提供してほしい。,-,-,大きな不安を感じることなくフライトを終えることができた。,スタッフの親切でわかりやすい対応により、初めて利用する空港での不安が解消された。,フライト中急な変更に対応してくれたスタッフの迅速な対応には感謝している。,-,出発からかなりの時間が経過しても食事が提供されず、降りる寸前に急いで食べるはめになった。,出発からかなりの時間が経過しても食事が提供されず、降りる寸前に急いで食べるはめになった。,-,出発からかなりの時間が経過しても食事が提供されず、降りる寸前に急いで食べるはめになった。,到着時に初めて利用する空港だったため不安を感じたが、スタッフの方が親切でスムーズに案内してくれた。,出発からかなりの時間が経過しても食事が提供されず、降りる寸前に急いで食べるはめになった。,-,S450-XLR,2025-03-20,HND-SFO,Economy Class,True,8,7,5,3,7,7,9,9
30,53,2024-12-13,先月、久しぶりに海外旅行でアメリカに行ってきました。普段は格安航空会社を利用することが多いのですが、今回は友人の結婚式に出席する関係で、やや高めの航空会社を利用しました。搭乗前に、事前にマイクロソフトアカウントと連携しておいたら、機内で自分のNetflixアカウントと連携でき、家で観ているような感覚で映画を楽しめました。非常に便利でした。高額なチケット代でも納得できるサービスだった。特にフライト中の食事やエンタメが非常に充実していた。,フライト中の食事が非常に充実していた。,Netflixアカウントと連携して映画を楽しめたことが非常に便利だった。,事前にマイクロソフトアカウントと連携しておいたら、機内でNetflixアカウントと連携できて、家で観ているような感覚で映画を楽しめた。,高額なチケット代でも、フライト中の食事やエンタメが充実していたので納得できた。,事前にマイクロソフトアカウントと連携しておいたら、機内で自分のNetflixアカウントと連携でき、家で観ているような感覚で映画を楽しめた。,"-

（理由：ポジティブな内容はあるものの、「客室スタッフのサービス」に関する具体的な記述がないため）",家で観ているような感覚で映画を楽しめた。,-,-,-,高額なチケット代に比べてサービスが充実していたため不満はなかった。,-,-,-,A392-300,2024-12-11,HND-CTS,Premium Economy,True,9,10,6,7,9,7,5,6
32,21,2024-12-12,先日は友人の結婚式に出席するために、海外からシンガポール経由で帰国しました。シンガポールから日本まではこの航空会社を利用しました。機内は快適で、特に座席のクッションが柔らかく、長時間でも疲れにくかったです。次回もこの航空会社を選びたいです。機内エンターテイメントも楽しみにしていたのですが、ゲームのバリエーションが少なすぎて、飽きてしまいました。もっと多様なゲームを提供してほしいです。,-,ゲームのバリエーションが少なかったのが残念だった。,-,機内は快適で、特に座席のクッションが柔らかく、長時間でも疲れにくかったです。,-,-,座席のクッションが柔らかく、長時間でも疲れにくかったです。,-,-,-,ゲームのバリエーションが少なすぎて飽きてしまったので、もっと多様なゲームを提供してほしい。,-,-,-,A470-900,2024-12-11,HND-ITM,Business Class,True,8,4,9,6,6,5,7,5
33,82,2024-12-08,先日、初めて海外旅行で利用した航空会社だったので期待していたが、残念な点が多かった。隣の席が非常に近く、リラックスして座れませんでした。もっとスペースを広げてほしいです。価格に対して期待したよりもサービスがシンプルで、支払った金額に見合った価値が提供されなかった。長時間のフライトで疲れたので、少しでも快適に過ごしたかったが、座席に座っていると、どうしても腰が痛くなります。もっと体に優しいデザインにしてほしい。,-,-,-,-,-,-,-,-,-,-,支払った金額に見合った価値が提供されなかった。,価格に対して期待したよりもサービスがシンプルで、支払った金額に見合った価値が提供されなかった。,価格に対して期待したよりもサービスがシンプルで、支払った金額に見合った価値が提供されなかった。,隣の席とのスペースが狭く、長時間座っていると腰が痛くなるため、もっと広々とした体に優しい座席にしてほしい。,E190-E2X,2024-12-07,HND-SFO,Economy Class,False,3,6,3,6,3,7,5,6
34,30,2024-11-12,先日、久しぶりに海外旅行でアメリカへ行きました。普段はLCCを利用することが多いのですが、今回は特別な旅行ということもあり、フラッグキャリアを利用しました。価格は高いと感じましたが、それに見合った素晴らしい快適さと、航空会社の対応が良かったので、結果的には満足しています。搭乗手続きの際、手荷物預けのスタッフが笑顔で対応してくれたのが印象的でした。そのまま気持ちよく飛行機に向かうことができたので、こうした接客が本当に大切だと思いました。しかし、料金が高いわりに、サービスやエンタメの質が低く感じられたのは残念でした。次回は価格を重視して別の航空会社を選ぶかもしれないと思いました。,-,"-

（レビューに「機内エンターテイメント」に関するポジティブな内容がないため）",-,高い料金に見合った素晴らしい快適さと対応だったので、結果的には満足している。,搭乗手続きの際、手荷物預けのスタッフが笑顔で対応してくれたのが印象的で、そのまま気持ちよく飛行機に向かうことができた。,搭乗手続きの際、手荷物預けのスタッフが笑顔で対応してくれたのが印象的だった。,素晴らしい快適さだった。,料金が高いわりに、サービスやエンタメの質が低く感じられたのは残念でした、と書かれているが、具体的にサービスやエンタメの内容については触れられていない。しかし、文脈から機内での食事や飲み物を含むエンターテイメント全般が期待外れだったと推測され、質の向上が望まれる。,料金が高いわりに、サービスやエンタメの質が低く感じられたのは残念でした、と書かれているが、具体的にサービスやエンタメの内容については触れられていない。しかし、文脈から機内での食事や飲み物を含むエンターテイメント全般が期待外れだったと推測され、質の向上が望まれる。,サービスやエンタメの質が低く感じられたのは残念でした。,料金が高い割にはサービスやエンタメの質が低く感じられた。,"料金が高いわりに、サービスやエンタメの質が低く感じられたのは残念でした、という記載は「機内サービス」に関する内容であり、「地上サービス」に関するネガティブな内容は特に記載されていません。したがって、該当する内容は存在しません。 
-",サービスやエンタメの質が低く感じられたのは残念だった。,料金が高い割にはサービスやエンタメの質が低く感じられた。,S360-TP,2024-11-11,HND-CTS,Business Class,True,7,7,6,6,8,5,5,9
35,92,2025-03-27,先月、久しぶりに海外旅行でアメリカに行ってきたんです。12時間のフライトだったので、機内食を楽しみにしていたんですが、食事の量が少なくてちょっと物足りなかったですね。せっかくの旅行なので、もう少しボリュームが欲しいと思いました。でも、座席が非常に広くて、両隣の乗客とぶつかることなくゆったりと過ごせました。,"-

（レビュー全体がネガティブな内容のため、ポジティブな「食事と飲み物」に関する内容は抽出できませんでした。実際には、食事の量が少ないという不満が述べられています。）

→単に「-」と回答する。

-","-
（レビュー内容に「機内エンターテイメント」に関するポジティブな内容がないため）",-,座席が広くてゆったりと過ごせたので、良いサービスだった。,座席が非常に広くて、両隣の乗客とぶつかることなくゆったりと過ごせました。,"-

レビュー内容に「客室スタッフのサービス」に関する記述がありません。 

→修正後：-",座席が非常に広くて、両隣の乗客とぶつかることなくゆったりと過ごせました。,機内食は量が少なくて物足りなかった。,機内食は量が少なくて物足りなかった。,-,食事の量が少なくて物足りなかった。,食事の量が少なくて物足りなかった。,機内食の量が少なくて物足りなかった。,"-
（レビュー内容からは「座席の快適さ」に関するネガティブな内容は抽出できないため、「-」と回答します。）",A430-200,2025-03-26,NRT-LHR,Premium Economy,True,7,6,9,4,6,6,6,5
36,35,2025-03-21,先日は出張で海外に行くため、初めてその空港を利用しました。初めての空港で迷子になってしまい、道に迷ってしまったのですが、スタッフの方が親切に対応してくれて、無事に目的地に辿り着くことができました。すごく助かりました。搭乗した飛行機は快適で、足元に十分なスペースがあり、フライト中も足を自由に動かすことができて良かったです。しかし、出張中にフライト時間を有効活用しようと思っていたのですが、機内Wi-Fi接続が不安定で、仕事が全く進みませんでした。追加でコストを払ったにも関わらず、あのような使えないネット接続はあり得ないと思いました。,-,搭乗した飛行機は快適で、足元に十分なスペースがあり、フライト中も足を自由に動かすことができて良かったです。,-,快適なフライトだったが、追加で支払ったにも関わらず不安定な機内Wi-Fiに不満があり、コストに見合ったサービスではなかった。,スタッフの方が親切に対応してくれて、初めて利用する空港で道に迷った際も無事に目的地に辿り着くことができ、すごく助かりました。,空港のスタッフの方が親切に対応してくれて助かりました。,足元に十分なスペースがあり、フライト中も足を自由に動かすことができて良かったです。,-,-,追加でコストを払ったにも関わらず、機内Wi-Fi接続が不安定で仕事が全く進まなかった。,追加でコストを払ったにも関わらず、機内Wi-Fi接続が不安定で仕事が進まなかった。,-,機内Wi-Fi接続が不安定で、追加でコストを払ったにも関わらず仕事が全く進まなかった。,-,A470-900,2025-03-20,HND-ITM,Economy Class,True,7,7,9,7,7,2,5,9
