review_id,user_id,review_date,review,pos_food_and_beverages_summary,pos_inflight_entertainment_summary,pos_wifi_connectivity_summary,pos_value_for_money_summary,pos_ground_service_summary,pos_cabin_staff_service_summary,pos_seat_comfort_summary,neg_food_and_beverages_summary,neg_inflight_entertainment_summary,neg_wifi_connectivity_summary,neg_value_for_money_summary,neg_ground_service_summary,neg_cabin_staff_service_summary,neg_seat_comfort_summary,flight_id,flight_date,route_id,seat_type,is_recommended,rating_overall,rating_seat_comfort,rating_cabin_staff_service,rating_ground_service,rating_value_for_money,rating_food_beverages,rating_ife,rating_wifi_connectivity
1,38,2024-12-17,最近、家族でアメリカに旅行に行ってきたんです。息子がアメリカに留学しているので、会いに行くためにロサンゼルスまで飛行機に乗りました。長時間のフライトだったので、できるだけ快適に過ごしたいと思って、少し高めの座席を予約したんです。でも、実際に座ってみると、座席が狭くて長時間のフライトがとても辛かった。隣の人とぶつかってしまい、快適ではありませんでした。でも、機内食は美味しかったし、サービスも良かったので、総合的には満足しています。帰りの飛行機は新しい機材だったようで、座席が新しくて清潔感があり、長時間座っても不快感がありませんでした。,機内食は美味しかった。,-,-,機内食が美味しく、サービスも良かったので、少し高めの座席を予約した甲斐がありました。,サービスは良かった。,サービスが良かったので、総合的には満足しています。,帰りの飛行機は座席が新しくて清潔感があり、長時間座っても不快感がなかった。,機内食は美味しかった。,機内食は美味しかった。,-,少し高めの座席を予約したが、実際には狭く長時間のフライトが辛かった。,-,辛くても機内サービスは良かった。,行きのフライトでは、座席が狭く隣の人とぶつかってしまい、長時間のフライトが辛かった。,S385-TP,2024-12-16,HND-CTS,Economy Class,True,8,5,3,7,6,7,5,5
79,77,2025-05-06,最近、家族で海外旅行に行った。長時間のフライトだったが、機内で提供されるエンタメコンテンツが多岐にわたり、毎回違った映画や番組を楽しめたのは助かった。しかし、食事が味気なく、子どもがほとんど食べなかった。もっと子ども向けのメニューが充実していると助かる。初めて利用した空港では、スタッフが困っていたときにすぐに声をかけて案内してくれたので、非常に助かった。,-,多岐にわたるエンタメコンテンツを楽しめたので、長時間のフライトも助かった。,-,機内で提供される多様なエンタメコンテンツが楽しめたのは助かった。,初めて利用した空港では、スタッフが困っていたときにすぐに声をかけて案内してくれたので、非常に助かった。,機内で提供されるエンタメコンテンツが多岐にわたり、毎回違った映画や番組を楽しめた。,-,機内食が味気なく、子どもがほとんど食べなかったため、子ども向けのメニューを充実させてほしい。,機内食が味気なく、子どもがほとんど食べなかったため、子ども向けのメニューを充実させてほしい。,-,食事が味気なく、子どもがほとんど食べなかった。,-,機内食が味気なく、子どもがほとんど食べなかった。,-,A392-300,2025-05-05,NRT-CDG,Business Class,True,7,9,5,3,7,7,6,9
104,59,2025-03-27,私は家族と一緒に海外旅行へ行った。フライト中に子どもたちが退屈しないようにWi-Fiを使いたかったが、接続が遅くて全く役に立たなかった。旅行の重要な部分が台無しになった。しかし帰りの飛行機では機内食を注文した際、スタッフが食事の温度や配膳に気を使ってくれて、どんな細かな要望にも対応してくれた。また、フライト中にもオンラインで映画を観たかったが、Wi-Fiの接続がとても速く、快適に視聴できた。長時間のフライトでも全く問題なかった。,帰りの飛行機では、機内食を注文した際、スタッフが食事の温度や配膳に気を使い、どんな細かな要望にも対応してくれた。,帰りのフライトではWi-Fiの接続が速く、オンラインで映画を快適に視聴できた。,帰りのフライトではWi-Fiの接続がとても速く、快適に映画を視聴できた。,帰りのフライトではスタッフが細かな要望に対応してくれたおかげで、長時間のフライトでも快適に過ごせた。,帰りの飛行機で機内食を注文した際、スタッフが食事の温度や配膳に気を使い、細かな要望にも対応してくれた。,帰りの飛行機では、機内食を注文した際、スタッフが食事の温度や配膳に気を使い、どんな細かな要望にも対応してくれた。,長時間のフライトでも全く問題なかった。,-,-,往路のフライトではWi-Fiの接続が遅くて役に立たなかった。,Wi-Fiの接続が遅くて役に立たなかったため、旅行の重要な部分が台無しになった。,機内食の注文時にスタッフが食事の温度や配膳に気を使ってくれなかった。,-,長時間のフライトでも問題なかったのは、帰りの飛行機でWi-Fi接続が改善されたからだが、往路では座席のエンターテイメント環境が不十分だった。,E260-E3,2025-03-26,HND-ITM,Premium Economy,True,6,6,7,7,5,10,9,6
9,54,2024-12-31,去年、初めて海外旅行でアメリカに行った時、長時間のフライトで疲れました。席が硬くて、何時間も座っているのが苦痛でした。もっとクッション性のある座席がいいです。足元も狭くて大変でしたが、私の足元のスペースが狭かったが、スタッフがすぐに配慮してくれ、リクライニングを調整してくれたので、少しは楽になりました。,-,-,-,スタッフが足元のスペースに配慮してくれ、リクライニングを調整してくれたので、少しは楽になりました。,スタッフが足元のスペースの狭さに配慮し、リクライニングを調整してくれたので、少しは楽になりました。,足元のスペースが狭かったが、スタッフがすぐに配慮してくれ、リクライニングを調整してくれたので、少しは楽になった。,スタッフがリクライニングを調整してくれたので、少しは楽になりました。,-,-,-,長時間のフライトで硬い席に座るのが苦痛だったが、スタッフの配慮で少しは楽になった。,スタッフの配慮により、足元のスペースが狭かった点は解消された。,足元のスペースが狭くて苦労したが、スタッフがすぐに配慮してくれてリクライニングを調整してくれたので少しは楽になった。,席が硬くクッション性がなく、足元も狭かったが、スタッフの配慮でリクライニングを調整してもらい少しは楽になった。,S450-XLR,2024-12-30,NRT-SIN,Economy Class,False,6,7,3,6,5,5,8,5
65,49,2025-02-19,先日利用した航空サービスは全体的に良かった。フライト中、何度も飲み物や食事をお願いしたが、スタッフはどんなリクエストにも笑顔で応じてくれ、非常にありがたかった。私は仕事で頻繁に海外を訪れるが、この航空会社を利用するのは今回で3回目だ。サービスは毎回安定しているが、今回は特に印象に残った。隣の席の乗客がトラブルを起こしていた際、スタッフの対応が非常に遅かったのは残念だった。もう少し迅速で効果的な対応をしてほしかった。フライト中の安全は最優先であるべきだと思う。,フライト中、何度もお願いした飲み物や食事の要望に、スタッフが笑顔で応じてくれたのは非常にありがたかった。,-,-,サービスは毎回安定しており、今回も全体的に良かった。,全体的にサービスは良かった。,フライト中、何度も飲み物や食事をお願いしたが、スタッフはどんなリクエストにも笑顔で応じてくれた。,-,-,-,-,スタッフの対応が遅かったトラブルについては、もっと迅速な対応を期待していたため残念だった。,"-
（理由：レビュー内容に「地上サービス」に関するネガティブな記述がないため）",隣の席の乗客がトラブルを起こした際、スタッフの対応が遅く、もっと迅速で効果的な対応を期待していた。,隣の席の乗客がトラブルを起こした際の対応が遅かった。,A430-200,2025-02-18,HND-SFO,Business Class,True,8,6,5,6,5,5,9,5
89,64,2025-04-09,私は普段から仕事で海外を飛び回っているが、最近利用した航空会社のサービスには残念な点が多かった。まず、座席の背もたれの角度が調整できず、長時間座っていると背中が痛くなった。フライト時間が長い場合は特に不満が募る。また、機内Wi-Fi接続が遅すぎて、仕事をするどころか、ネットサーフィンさえできなかった。フライト時間を無駄に過ごした気分だった。しかし、フライトが遅れた際、スタッフが待機中の案内をしっかり行ってくれ、遅延の原因や最新情報を逐一提供してくれたのは助かった。こうした細やかな配慮に救われた。,-,"-

 理由：[抽出条件]に該当するポジティブな内容がレビュー内に存在しないため。レビュー内では機内Wi-Fi接続に関する不満が述べられており、これは「機内エンターテイメント」に該当する内容ではあるものの、ポジティブな内容ではないため。",-,フライトが遅れた際、スタッフが待機中の案内をしっかり行ってくれ、遅延の原因や最新情報を逐一提供してくれたのは助かった。,フライトが遅れた際、スタッフが待機中の案内をしっかり行い、遅延の原因や最新情報を逐一提供してくれたのは助かった。,フライトが遅れた際、スタッフが遅延の原因や最新情報を逐一提供してくれた細やかな配慮に救われた。,-,-,-,機内Wi-Fiの接続が遅すぎて、仕事やネットサーフィンもできず、フライト時間を無駄に過ごした気分だった。,長時間のフライトにもかかわらず、座席の調整機能が不十分で、機内Wi-Fiも遅くて使い物にならなかったので、料金に見合ったサービスではなかった。,"フライトが遅れた際のスタッフによる待機中の案内はしっかり行われていたが、レビュー内ではそれ以前の遅延に対する案内や対応についての不満は特に述べられていないものの、遅延時の対応は評価されていた。→ 
-
 ではなく、以下のように修正： 
フライト遅延時のスタッフの案内はしっかりしており、遅延の原因や最新情報を逐一提供してくれたのは助かったが、それ以前の遅延に対する最初の案内が不十分だったというわけではないので、ネガティブな内容ではない。レビュー内でネガティブな地上サービスについての直接的な言及はないため、 
-
とすべき。 
しかし、指示に従い、レビュー内のネガティブな内容を精査すると、地上サービスに関する直接的な不満は書かれていないが、間接的に関連すると思われる内容もない。よって、 
-
最終的な要約結果は「-」となる。 
ただし、より適切な要約を目指すと、レビュー内容から「地上サービス」に関連するネガティブな内容を抽出できなかったため、「-」とする判断となる。 
要約結果： 
-",ネガティブな内容は特にない。,座席の背もたれの角度が調整できず、長時間座っていると背中が痛くなった。,S360-TP,2025-04-08,HND-ITM,Business Class,True,5,6,3,7,6,3,6,9
2,46,2025-02-17,先日、久しぶりに海外旅行でアメリカへ行きました。普段は格安航空会社を利用することが多いのですが、今回は特別な旅行ということもあり、プレミアムエコノミーで飛行機に乗ることにしました。機内での過ごし方については、映画を観るのが楽しみの一つです。今回のフライトでもいくつか映画を観たのですが、機内で観た映画が、家で観るよりも圧倒的に高画質で、まるで映画館にいるような気分になりました。しかし、料金が高い割に、提供されるアメニティが非常に基本的で、もっと高品質なサービスを提供すべきだと感じたのが正直な感想です。,"-
（レビューからは「食事と飲み物」に関するポジティブな内容が抽出できなかったため）",映画が家で観るよりも圧倒的に高画質で、まるで映画館にいるような気分になった。,"-

（レビュー内容に「機内Wi-Fiと接続性」に関する記述がないため）",機内での映画が家で観るよりも圧倒的に高画質で、映画館にいるような気分になった。,"-
このレビューには「ポジティブ、かつ「地上サービス」に該当する内容」はありません。レビューは主に機内サービスについての感想で、地上サービスに関する言及がないためです。","-

レビューに「客室スタッフのサービス」に関するポジティブな内容は含まれていませんでした。代わりに、映画の画質についての感想が述べられています。ただし、抽出条件に合致する内容ではないため、「-」とします。 

→ 「-」 

ただし、指示に従い、簡潔に「-」とします。",機内で観た映画が高画質で、まるで映画館にいるような気分になった。,料金が高い割に、アメニティが非常に基本的な内容だった。,料金が高い割に、アメニティが非常に基本的な内容だった。,-,料金が高い割に、アメニティが基本的なままなのは改善すべき。,料金が高い割に、アメニティの質が低いと感じた。,料金が高い割に、アメニティの質が低く感じた。,料金が高い割に、提供されるアメニティが非常に基本的で、高品質なサービスが期待できない。,S385-TP,2025-02-16,NRT-SIN,Premium Economy,True,6,10,6,7,3,5,6,7
3,32,2025-04-23,今回のフライトは、家族と一緒にヨーロッパへ旅行するのが目的だった。搭乗直後は、機内スタッフの接客も行き届いており、快適なフライトを期待していた。しかし、フライト中に乱気流に遭遇し、機体が大きく揺れた。緊急時に、機内スタッフが何も指示を出さず、乗客は不安そうに過ごしていた。パニックに陥りそうな状況で、もっと冷静で確実な対応を期待していた。その後は無事に通常飛行に戻り、機内で出されたワインが非常に美味しく、フライト中にリラックスした時間を過ごせた。,機内で出されたワインが非常に美味しく、リラックスした時間を過ごせた。,ワインが非常に美味しく、リラックスした時間を過ごせた。,-,機内で出されたワインが非常に美味しく、リラックスした時間を過ごせた。,搭乗直後は機内スタッフの接客が行き届いており、快適なフライトを期待していた。,搭乗直後は機内スタッフの行き届いた接客で快適なフライトを期待していた。,機内で出されたワインが非常に美味しく、リラックスした時間を過ごせた。,-,-,-,機内での緊急時の対応に不安を感じ、サービスに価値を感じられなかった。,機内スタッフの接客は行き届いていたが、乱気流遭遇時の対応に不安を感じた。,乱気流に遭遇した際、客室スタッフが緊急時の指示を出さず、乗客を不安にさせた。,-,A450-800,2025-04-22,NRT-SIN,Premium Economy,False,6,7,5,9,6,7,2,5
4,21,2025-05-05,先日利用した航空会社のサービスは残念でした。長距離移動で喉が乾いていたので、フライト中に飲み物を注文したのですが、なかなか持ってきてもらえず、かなり乾ききってしまいました。チケットの料金は高く感じましたが、実際のサービスがそれに見合っていなくて、コストパフォーマンスが悪いと感じました。また、機内エンターテイメントで映画を観ていたのですが、シートのヘッドホンの音量がバラバラで快適に楽しめませんでした。私は普段から出張でよく飛行機を利用しますが、今回の体験は特にがっかりでした。,-,"-

レビューに「機内エンターテイメント」に関するポジティブな内容は含まれていません。代わりに、ヘッドホンの音量がバラバラで快適に楽しめなかったという不満が述べられています。 

この場合、指示に従い、ポジティブな内容ではないため、「-」と回答します。 

要約すると、「-」です。",-,-,-,-,-,飲み物の注文がなかなか届かず、長距離移動で喉が乾いているときに待たされたのが残念だった。,飲み物の注文がなかなか届かず、長距離移動で喉が乾いているときに待たされたのが残念だった。,-,チケットの料金は高く感じたが、実際のサービスがそれに見合っていなくて、コストパフォーマンスが悪かった。,チケットの料金は高く感じたが、実際のサービスがそれに見合っていなかった。,飲み物を注文したのに、なかなか持ってきてもらえず、喉が乾ききってしまった。,シートのヘッドホンの音量がバラバラで快適に映画を楽しめなかった。,E180-E2,2025-05-04,NRT-LHR,Business Class,False,2,3,6,3,3,6,6,6
5,15,2025-01-13,今回の航空会社の利用は、仕事で頻繁に海外を訪れる友人の結婚式に出席するため、初めて利用しました。料金が高かったが、その分だけ快適さが充実しており、全体的に大満足のフライトだった。料金に見合った素晴らしいサービスがあり、非常に快適なフライトとなった。コスパが良いと感じた。特に印象的だったのは、乗務員が出発前に安全確認をしっかりしてくれ、飛行中も状況を適切にアナウンスしてくれたので、非常に安心して過ごせたことです。,"-

レビューに「食事と飲み物」についての具体的な言及はありませんでした。ただし、レビュー全体の文脈から、サービス全般に対する高い評価がうかがえます。",-,-,料金に見合った素晴らしいサービスがあり、コスパが良いと感じた。,出発前に乗務員が安全確認をしっかりしてくれたので、非常に安心して過ごせた。,乗務員が出発前にしっかり安全確認を行い、飛行中も適切に状況をアナウンスしてくれたので、安心して過ごせた。,料金が高かった分、快適さが充実していた。,-,-,-,料金が高かった。,-,-,-,E190-E2X,2025-01-10,HND-CTS,Business Class,True,9,5,5,6,9,5,9,7
6,6,2025-02-20,先月、久しぶりに海外出張でアメリカに行った。現地での仕事が立て込んでいて、機内でビジネスメールの送信に追われることは想定内だったので、機内Wi-Fiのサービスに期待していたが、つながらず大きな問題が生じた。でも、帰りの飛行機では機内Wi-Fiの接続速度が早く、動画や音楽のストリーミングが途切れず楽しめた。,-,帰りの飛行機では、機内Wi-Fiの接続速度が早く、動画や音楽のストリーミングが途切れず楽しめた。,帰りの飛行機では接続速度が早く、動画や音楽のストリーミングが途切れず楽しめた。,機内Wi-Fiの接続速度が早く、動画や音楽のストリーミングが途切れず楽しめた。,帰りの飛行機では機内Wi-Fiの接続速度が早く、動画や音楽のストリーミングが途切れず楽しめた。,"-

レビューに「客室スタッフのサービス」についての記載はなく、機内Wi-Fiの接続速度についての言及のみであったため、抽出条件に該当する内容はなかった。ただし、厳守事項に従い、単に「-」とだけ回答する。

-",帰りの飛行機では機内Wi-Fiの接続速度が早く、動画や音楽のストリーミングが途切れず楽しめた。,-,-,行きの飛行機ではつながらず大きな問題が生じた。,機内Wi-Fiがつながらず、海外出張中にビジネスメールが送れなかった。,機内Wi-Fiに接続できず、ビジネスメールの送信に支障をきたした。,機内Wi-Fiがつながらず大きな問題が生じた。,-,S360-TP,2025-02-19,NRT-CDG,Premium Economy,True,6,5,5,6,5,9,5,7
7,65,2025-04-05,先月、家族で海外旅行に行った際、利用しました。荷物を受け取る際、他の乗客との混雑でぶつかり合いがありましたが、スタッフは対応せず、誰も問題を解決しなかったので残念でした。もっと注意深く運営してほしいです。機内では、子供が映画を楽しみにしていたのですが、コンテンツ更新が遅く、同じ映画ばかり見せられて飽きてしまいました。もっと新しいものを追加してほしいです。,-,新しいコンテンツを追加してほしい。,-,-,-,-,-,-,-,-,スタッフの対応や機内エンターテイメントのコンテンツが不十分だったので、もっとサービスを充実させてほしい。,荷物受け取り時に他の乗客とぶつかり合ったが、スタッフが対応しなかったので、もっと注意深く運営してほしい。,荷物を受け取る際の混雑で他の乗客とぶつかり合ったが、スタッフが対応しなかった。,-,B812-6,2025-04-04,HND-LHR,Business Class,False,4,3,5,7,7,5,6,3
8,52,2024-12-28,私は普段から出張で頻繁に飛行機を利用しています。最近、ある航空会社の便を利用した際、機内のエンターテイメントに感動しました。飛行機内のスクリーンが大きく、映画を観る際に視覚的な楽しさが倍増しました。しかし、快適さに関しては少し残念な点もありました。シートピッチが狭すぎて足が窮屈でした。もっと広い席にして欲しいです。長時間のフライトではこの点が気になりました。,-,スクリーンの大きさが良く、映画鑑賞がより楽しくなった。,-,機内のエンターテイメントが充実しており、大きなスクリーンで映画を楽しむことができた。,"-

レビュー内容からは、機内サービスに関する記述はあるものの、「地上サービス」に関するポジティブな内容は見当たらなかったため、「-」とします。",-,-,-,-,-,シートピッチが狭く長時間のフライトでは窮屈に感じた。,-,-,シートピッチが狭くて足が窮屈だったので、もっと広い席にして欲しい。,E260-E3,2024-12-26,NRT-LHR,Business Class,True,7,9,3,7,5,7,7,5
10,75,2025-04-11,先日、海外旅行で利用しました。旅行先で荷物が届かず、空港スタッフに問い合わせたが、返答が遅く、手続きも煩雑だったので、結局、荷物が届くまでの数日間、非常に不便な思いをしました。現地での観光もままならず、楽しみにしていた分、残念な気持ちが強かったです。帰りの飛行機では、座席のシートカバーが汚れていたのも気になりました。もっと清潔に保って欲しいと思います。,-,-,-,-,-,-,-,-,-,-,荷物が届かず数日間不便な思いをしたうえ、シートカバーも汚れていたので、料金に見合ったサービスではなかった。,荷物が届かず、空港スタッフの返答が遅く、手続きも煩雑だったため、旅行中に不便な思いをした。,帰りの飛行機では、座席のシートカバーが汚れていたので、もっと清潔に保って欲しい。,帰りの飛行機の座席のシートカバーが汚れていたので、もっと清潔に保って欲しい。,A425-900,2025-04-10,HND-LHR,First Class,False,3,6,3,7,6,6,6,2
